,Job Title,Salary Estimate,Job Description,Rating,Company Name,Location,Size,Founded,Type of ownership,Industry,Sector,Revenue
0,Home Health Aide,Employer Provided Salary:$30 - $35 Per Hour,"Home Health Aide (HHA)
National Home Health is a leading provider of in-home healthcare in Northern California with accreditation through the Joint Commission of Accreditation of Healthcare Organizations. At this time we are looking for a full-time/part-time California Certified Home Health Aide (HHA) in:
Location: San Rafael, Novato, Petaluma, and surrounding areas
Compensation: $-30-35/ per visit
Position Qualifications include but are not limited to the following:
Home Health Aide certification was obtained through the successful completion of a program approved by the California Department of Public Health. Certification must be current with the California Department of Public Health Licensing and Certification Division. Applicants without this license will not be considered for employment (Please visit: http://cvl.cdph.ca.gov/SearchPage.aspx to verify certification).",4.0,"National Home Health Services
4.0","Novato, CA",1 to 50 Employees,2009,Company - Public,Health Care Services & Hospitals,Health Care,Less than $1 million (USD)
1,Physical Therapist Aide for Home Health,Employer Provided Salary:$40 Per Hour,"What You Will Do:
As a home health physical therapist, you will provide one on one treatment and care to patients in their home using a comprehensive and patient specific care plan, innovative solutions, and a preferred technology for point of care documentation. You will have the opportunity to spend quality time with the patient, in their own home, to promote their health and independence. You will have autonomy in addition to the support and collaboration of a full team of healthcare professionals.
Collaborate with physicians, patients and their families, nurses, therapists, social workers and other members of the patient care team to develop and implement a patient specific care and treatment plan
Cooperatively utilize varied solutions to educate and promote the health and independence of the patient",-1,Gentle Shepherd Home Health Care,"Oklahoma City, OK",51 to 200 Employees,-1,Company - Public,Health Care Services & Hospitals,Health Care,Unknown / Non-Applicable
2,"Certified Home Health Aide (CHHA) $1,000 Sign On Bonus",-1,"CHHA (Inland Empire and San Gabriel)
Haven Health is a Hospice, Palliative, and Home Health agency in Southern California is hiring a CHHA/HHA. We have established a reputation for providing quality clinical care along with culturally-sensitive support.
Here at Haven, we strive to ensure that our employees feel confident in being able to excel in their positions. We provide hands-on training to ensure every employee is comfortable in accomplishing their assigned tasks and we have an exceptional support system by ensuring all of our Supervisors are readily available to provide guidance.
So if you're ready to help us lay the groundwork for our ever-growing company, then we invite you to join our team! You will have the opportunity to learn and work alongside industry experts who have been in the healthcare field for over 15 years.",-1,Haven Health,"Los Angeles, CA",-1,-1,-1,-1,-1,-1
3,Private In-Home Caregiver,Employer Provided Salary:$20 - $24 Per Hour,"Seeking privately hired in-home caregivers for easy-going, friendly female in quiet, comfortable residential setting in Grafton, MA.
Client has significant mobility limitations / neurological conditions, and will require assistance with transferring to wheelchair, showering/bathing, personal care, and meal preparation.
Seeking both day-time/night-time, full-time/part-time shifts.
CNA degree and/or prior experience with a Hoyer Lift a plus.
Job Type: Full-time
Pay: $20.00 - $24.00 per hour",-1,Blank Private,"Grafton, MA",-1,-1,-1,-1,-1,-1
4,Home Health Aide,Employer Provided Salary:$20 Per Hour,"CAREGIVER
$900 Hiring Bonuses
YOUR REWARDS
Competitive Wages & Salaries
Flexible Work Schedules
Hiring Cash Bonuses
Unlimited Referral Cash Bonuses
Paid Time Off
Paid Training",3.5,"Attention Plus Care
3.5",United States,51 to 200 Employees,-1,Company - Private,Health Care Services & Hospitals,Health Care,$1 to $5 million (USD)
5,Home Health Aide - Immediate Need,Employer Provided Salary:$17 Per Hour,"Caregiver for Elderly
Caregivers, CNA's, HHA's - Immediate Need
Seeking exceptional caregivers who want to help our clients Live Well and Be Well.
WALK IN INTERVIEWS: Stop by the office Monday-Thursday for an on the spot interview! No appointment needed, just call 978-577-5755 for hours.
Location: 66 Tadmuck Road, Suite #5 in Westford.
Why Granite Willow?
Weekly pay at top rates based on experience $17+
: Full Time, Part Time, Set or Flex Schedules Available. Many openings",-1,Granite Willow LLC,"Chelmsford, MA",Unknown,-1,Company - Public,-1,-1,Unknown / Non-Applicable
6,Private Home Caregiver,Employer Provided Salary:$28 Per Hour,"Looking for care/assistance for a successful retirement age businessman. He started from scratch a cattle/farming operation that spans a multi-state area but has had some major setbacks in overall health. He does not want to slow down in everyday life and wants to continue being involved with the family business. He needs assistance with his daily tasks. The job site/home is just south of Overland Park, KS in town of Bucyrus, KS.
He is struggling with his oxygen levels upon exertion. He requires a walker to move around the house and needs assistance getting up out of a chair. He is very quick-witted with an ornery personality. He enjoys having fun with others. Caregiver must have some thick skin and be willing to handle some of his moments of being frustrated with his current condition.
You will be tasked with helping the patient with personal hygiene, minor medical needs, housekeeping, and other daily needs as required by the patient. To excel in this role, you should have an interest in health care as well as an interest in the patient's happiness/well-being. We are looking for a caring individual who has the ability to work with limited supervision while keeping the patient's needs as your top priority.",-1,Foote Cattle Company,"Bucyrus, KS",201 to 500 Employees,-1,Company - Private,-1,-1,Unknown / Non-Applicable
7,"CNA / HCA / NAR Caregiver for Home Health , 12-Hour Shifts",Employer Provided Salary:$22 Per Hour,"Careforce is a private duty and medicaid home care and home health company that's been around for 20 years. Serving King and Snohomish counties, Careforce takes pride in its clinically oriented model of care delivery that sets the standard in caregiving.
In need of caregivers and nurses with great communication, willingness to be self starters, and years of great experience! We employ those with a passion to make a difference in the lives of vulnerable adults throughout the Puget Sound area. If helping others is a part of who you are, then apply with Careforce today! We are a great family owned company that values our employees and are constantly working hard on giving back.
Benefits
Medical Insurance",4.6,"Careforce Inc
4.6","North Bend, WA",51 to 200 Employees,1999,Company - Private,Health Care Services & Hospitals,Health Care,$1 to $5 million (USD)
8,Home Health Aide,Employer Provided Salary:$16 - $21 Per Hour,"Certified Home Health Aide (Hospice) (02102113)
Mid Michigan Home Health & Hospice is seeking CNA for our Home Care & Hospice Division. Under RN Supervision, you'll assist with activities of daily living and perform personal care services to patients in varying environments. You may also provides light housekeeping as needed and laundry related to patient care.
We have competitive wages and benefits available.
Qualifications: .
Valid driver's license and automobile insurance in the State of Michigan.
Reliable transportation to meet work schedule.
One (1) year home health aide experience (Hospice Aide Training Program can be substituted for homecare/hospice experience).",2.7,"MID MICHIGAN HOME HEALTH & HOSPICE LLC
2.7","Flint, MI",Unknown,-1,Company - Private,-1,-1,Unknown / Non-Applicable
9,Caregiver/Home Care Aide Weekly Pay,Employer Provided Salary:$15 - $16 Per Hour,"Earn up to $740 / week plus a $300 Signing Bonus!
Looking to work for a home care company that values passion and rewards its caregivers with flexible scheduling, amazing benefits, consistent hours, and 24/7 support? Join Honor as a Caregiver, we are hiring immediately!
Join a growing home care agency where you're valued and your work makes an impact on people’s lives—including your own. We are currently looking for compassionate and dependable caregivers who are ready to begin working in Monterey and surrounding areas.
As a Caregiver, we highly encourage you to foster genuine relationships with the seniors in your community. We’re relying on you to do your best to keep every senior client healthy, safe, happy and independent at home. If you’re ready to join us in making a difference in older adults’ lives, we’d love for you to apply!",3.1,"Honor
3.1","Salinas, CA",201 to 500 Employees,2014,Company - Private,Health Care Services & Hospitals,Health Care,Unknown / Non-Applicable
10,Caregiver/CNA/ Home Health Aide,Employer Provided Salary:$14 - $16 Per Hour,"Come join Visiting Angels - we have an immediate need for Caregivers, CNA's and Home Care Aides to work morning, afternoon, evening and overnight shifts. Work with seniors in their homes throughout the area. Become a part of our team and join our mission to enhance the lives of aging adults throughout your community.
Open Positions
Caregivers, Nursing Assistants, Home Care Aides - No Certifications necessary, but a passion for caring for seniors is required. Ideal for students, retirees, animal lovers, and professionals that would love to earn while making a difference.
Some of the hours available include: Apple Valley, Golden Valley, Minneapolis, Edina, Burnsville, Eagan to name a few
Benefits",-1,Visiting Angels,"Edina, MN",-1,-1,-1,-1,-1,-1
11,Caregiver/ Home Health Aide,Employer Provided Salary:$19 Per Hour,"PLEASE READ THE FOLLOWING BEFORE APPLYING:
The Helper Bees has multiple elderly clients in Chicago, IL who need a caregiver.
Schedule: Mondays-Fridays 3pm-7pm (total of 20 hours weekly); 2 days a week for 4hr shifts (total of 8 hours weekly); Saturdays-Sundays 7am-10am (total of 6 hours weekly)
Job Tasks: Medication Reminders, Meal Preparation, Laundry, Light Housekeeping, Cognitive Supervision, Companionship, Errand Running, Toileting, Grooming, Pet Care, Showering, Dressing, Transferring
Pay: $19.15/hour
For the best experience, we suggest completing this application on a laptop or computer.
Our ideal candidate:
A friendly, compassionate, patient, and dedicated personality
- Communicative and determined - always does their best",4.2,"The Helper Bees
4.2","Chicago, IL",201 to 500 Employees,2015,Company - Private,Insurance Carriers,Insurance,Unknown / Non-Applicable
12,"Caregiver/Home Health Aide~(DenverCounty, Co) **Bonus Available**",Employer Provided Salary:$18 - $25 Per Hour,"COMPLETE VETTING FOR THIS POSITION BY NOVEMBER 30th AND RECEIVE A $200 BONUS!
CareLinx and several large health plans are partnering to provide thousands of members with in-home care benefits starting in 2022! As a caregiver, you will be assisting members with their daily activities and needs and providing support to them in their homes and communities. This work is pivotal and provides important insights to help improve the overall health of these members. Our programs with these members will be running for at least a year, which provides steady work opportunities with competitive pay to reliable and professional caregivers! Space is limited! We need caregivers as soon as possible for work to begin in January 2022. [Space in the program is limited, so take advantage of this great opportunity today.]
* If you successfully complete vetting and training for the program, you will be eligible for exciting raffle prizes and giveaways including:",4.3,"CareLinx
4.3","Denver, CO",1 to 50 Employees,2012,Company - Private,Health Care Services & Hospitals,Health Care,$5 to $10 million (USD)
13,"We have all the shifts you need, Short/Long Shifts HHA/CNA, $13+",Employer Provided Salary:$13 - $15 Per Hour,"***We provide all Personal protective equipment to perform your job***
Home Care Assistance is the nation's leading provider of premium in-home care and a great company to start or accelerate your career. In every community we serve, our local care team is ready to assist our clients and our caregivers. That means you'll get the professional support and guidance you need 24/7.
You will be providing one on one care with patients in the comfort of their own homes. We assist with all activities of daily living. Provide transportation, companionship, patient advocacy, and household management.
Requirements:
Must have compassion, dependability and be a hard worker",-1,Home Care Assistance Orlando,"Orlando, FL",-1,-1,-1,-1,-1,-1
14,"Live-In Aides $221-$230/day, Home Health Aides, Personal Care Aides + Bonus",Employer Provided Salary:$28 - $29 Per Hour,"Live-In Aides $221-$230/day, Home Health Aides (HHA) Personal Care Aides (PCA)
Great Opportunity + $250 sign-on Bonus + Excellent Benefits
Pediatric Cases and Split Shifts Available
Love helping Families in Need
Love Children, Love helping Moms
IMMEDIATE HIRE!
Now hiring for all 5 boroughs!
Anchor Health Home Care of New York, a fully licensed and growing Home Care Agency serving the NY Metropolitan area is seeking a compassionate Home Health Aide to provide aide in home care services.",4.4,"Anchor Home Health Care Services
4.4","New York, NY",501 to 1000 Employees,-1,Unknown,-1,-1,Unknown / Non-Applicable
15,Certified Home Health Aide (CHHA),Employer Provided Salary:$25 Per Hour,"Hospice company seeks motivated hard-working employees for patients in the High Desert area. Duties included, but not limited to: bathing assistance, personal hygiene and grooming, medication reminders, light housekeeping, and assistance with transferring. Job Requirements: -Valid state issued identification and proof of citizenship.-Current CHHA License Current CPR/First Aid Card-Current TB and physical-Must be able to pass a criminal background check-Only applicants with resumes will be considered.
Job Type: Part-time
Pay: $25.00 per hour
Schedule:
Day shift",-1,St. Bernardine Hospice Care,"Apple Valley, CA",-1,-1,-1,-1,-1,-1
16,Licensed Vocational Nurse LVN Home Caregiver,Employer Provided Salary:$38 Per Hour,"About us
Private Family - ONE patient!
Licensed Vocational Nurse LVN Private Caregiver
LVN Home caregiver
Nurse Caregiver for adult daughter (physically small, 5 feet, 110lb) with special needs. Must be LVN with current license. Must be physically fit in order to help with transitions. Always secondary person available for assisting. Daughter with great sense of humor; blind; nonverbal, not ambulatory. Loving family home. Multiple shifts available. Meals included during shift. Must be able to work weekend shifts. Flexible shifts. Great for LVN attending nursing school.
Job Type: Full-time or Part-time opportunities",-1,Private Family,"Ventura, CA",-1,-1,-1,-1,-1,-1
17,"Resident Assistant/Home Health Aide, FT Overnight, $1,000 Sign on Bonus!!!",Employer Provided Salary:$15 - $19 Per Hour,"We are looking for Home Health Aides to join our team at Prairie Bluffs Senior Living!
Home Health Aides provide assistance to clients with activities of daily living, such as dressing, grooming, toileting, moving safely to activities or functions, medication assistance and caring for the client's environment.
The ideal candidate for this position has a CNA certificate or equivalent training and Home health aide experience. Must have a genuine desire to work with the elderly and/or disabled. Effective oral and written skills, empathy, the ability to listen, good time management skills, professional speech and behavior are required. Ensures that required documentation is complete and in compliance with regulations and standards.
Job Types: Full-time
Pay: $15.00 - $19.00 per hour",1.0,"Prairie Bluffs Senior Living
1.0","Eden Prairie, MN",1 to 50 Employees,-1,Company - Private,Health Care Services & Hospitals,Health Care,$1 to $5 million (USD)
18,Caregiver / Home Health Aide / Certified Nursing Assistant,Employer Provided Salary:$20 Per Hour,"Tribute Home Care is looking for remarkable caregivers to join our North of Boston Team!
We’re mission driven * We’re diverse * We’re growing
At Tribute Home Care, our focus is simple: the caregiver. We hire only the best caregivers and surround them with a community that supports, celebrates, and recognizes the value of what they give others. Our team is brought together by our common values: treating each other with love, doing what’s right, and building community.
If you are looking to join a community of remarkable caregivers and find meaning in making a difference in the lives of others, you can find a home at Tribute.
As a Tribute caregiver, you’ll receive:",4.8,"Tribute Home Care
4.8","Lynn, MA",201 to 500 Employees,2012,Company - Private,Health Care Services & Hospitals,Health Care,$10 to $25 million (USD)
19,CNA In-Home Caregiver,Employer Provided Salary:$28 Per Hour,"About us
Private Family - ONE patient!
CNA In-Home Caregiver
Nurse Caregiver for adult daughter (physically small, 5 feet, 110lb) with special needs. Must be CNA with current license. Must be physically fit in order to help with transitions. Always secondary person available for assisting. Daughter with great sense of humor; blind; nonverbal, not ambulatory. Loving family home. Multiple shifts available. Meals included during shift. Must be able to work weekend shifts. Flexible shifts. Great for CNA attending nursing school.
Job Type: Full-time or Part-time opportunities",-1,Private Family,"Oxnard, CA",-1,-1,-1,-1,-1,-1
20,Private In-Home Caregiver for Elderly Woman with Parkinson's,Employer Provided Salary:$18 - $20 Per Hour,"Seeking caring person to help with in-home care for elderly woman
8:00 am to noon, Monday to Friday.
16 to 20 hours per week
$18 to $20/hr., depending on experience
We are a family looking for a compassionate and experienced caregiver to help our mother to stay safe and happy in our home. She will need help with getting in and out of bed, using the bathroom and shower, dressing, eating and other tasks of daily living.
You are:",-1,Confidential,"Wellington, OH",-1,-1,-1,-1,-1,-1
21,CNA/Home Health Aide,Employer Provided Salary:$25 Per Hour,"We are looking for enthusiastic, dependable and reliable CNA's and HHA's with a heart for the aging and ready to start ASAP in Martin County. Our company is family owned and operated serving Florida residents since 1997. Cases that we offer range from 4hr. shifts to 12hr. shifts, per diem as well as Live-In and involve assisting the elderly community with personal care, homemaking, companionship, transportation, etc.
Sign on BONUS and REFERRAL BONUS available as well!!!
As an Independent Contractor YOU are the boss.
YOU have the freedom to work where YOU want and when YOU want.
YOU have the freedom to accept or decline any referrals we offer.",-1,"VIP America of Central Florida, LLC","Jupiter, FL",-1,-1,-1,-1,-1,-1
22,Home Health Aide (HHA),Employer Provided Salary:$17 Per Hour,"For immediate consideration, please call Samantha Muscia at 201-258-9588!
Walk-in interviews available at 299 Market Street, Suite 145, Saddle Brook, NJ 07663. Ask about our $200 Sign on Bonus!
Are you tired of the pace of caring for multiple patients at a time? Do you enjoy developing relationships with people? Would you like to make your own schedule at a premium pay rate? Privatus is the company for you!
ABOUT THE JOB:
Privatus Care Solutions is seeking experienced, per diem Home Health Aides that enjoy the benefits and luxury of caring for only one person at a time! We have offices in NJ, MA, NY, & CT - but are busy and looking for CHHA’s throughout Bergen, Essex, Morris, Hudson, and Passaic Counties in NJ. We offer the flexibility of choosing from shifts ranging from 4-hour to 12-hour as well as live-in assignments.",3.9,"Privatus
3.9","Newark, NJ",201 to 500 Employees,2005,Self-employed,Health Care Services & Hospitals,Health Care,Unknown / Non-Applicable
23,Caregiver / HHA / CNA / LPN NEEDED,Employer Provided Salary:$11 - $30 Per Hour,"Caregiver / HHA / CNA / PCA NEEDED. Do you have a loving and compassionate heart? Our Open Job Opportunities are located in Fort Lauderdale, Plantation, Sunrise, Tamarac/Coral Springs, Pompano Beach, Coconut Creek, Pembroke Pines, Davie, Weston, Deerfield Beach
What We’re Looking For:
IMMEDIATE NEED HHA/C.NA. – competent, compassionate, hard working, altruistic, dedicated, flexible, honest, reliable, friendly applicants, who have a great deal of patience for working with the elderly population to keep our clients safe, happy, and healthy at home. We are looking for applicants to join our team and provide excellent care and have respect for the dignity for our family of patients. You have worked for the rest, now work for the BEST!!!! We promote a family-type, empowering atmosphere. Feel appreciated, like a STAR, join our team today!
Advanced Global Healthcare, Inc offers:",-1,"ADVANCED GLOBAL HEALTHCARE, INC","Fort Lauderdale, FL",-1,-1,-1,-1,-1,-1
24,"In-Home Caregiver (We train & certify HCA! Apply today, $19-23.45/hr!)",Employer Provided Salary:$19 - $23 Per Hour,"Job Overview: Our In-Home Caregiver is the driving force of our company. They bridge the gap between our management team and our clients. Through their service, they give our clients the exceptional care they require to make them feel like part of our family. We recognize the dedication and devotion our caregivers which is why we provide them with ongoing education and ability to advance as they understand what it takes to make an impact.
About the company: villageplan™ is excited to provide holistic and complex care to the geriatric community. Through our in-home health care services, we thrive in delivering family support, professional guidance producing positive outcomes. We continue to offer innovative, client-focused healthcare services in Spokane, Seattle, and surrounding communities with continued success. As we expand, we are seeking talented applicants who share our compassion and believe in our mission to continue to act as advocates in providing expert direction and care to families navigating complex and age-related challenges as we provide care to our seniors.",-1,villageplan™,"King Hill, WA",Unknown,-1,Company - Private,-1,-1,Unknown / Non-Applicable
25,Stein Assisted Living CNA/Home Health Aide,Employer Provided Salary:$17 - $18 Per Hour,"Stein Assisted Living a division of Wilf Campus located in Somerset, NJ, you’ll find senior living and elderly care with all the comforts of home; a warm, inviting environment where a lifestyle is embraced and there’s always good company and good food to share. Here, seniors live life to the fullest with the support of our professional caregivers.
We offer a range of senior programs and services in central New Jersey, such as HUD Housing, Assisted Living, Hospice, and Transportation
Our assisted Living Facility, The Martin and Edith Stein Assisted Living Residence is committed to providing personalized assisted living support in a pleasant, homelike environment to our seniors.
Be a part of a dynamic & talented team of professionals who share a passion for the care we provide & the experience we create for our residents every day.",4.0,"Stein Assisted Living - Transitional Unit
4.0","Somerset, NJ",51 to 200 Employees,-1,Unknown,-1,-1,Unknown / Non-Applicable
26,Actively Seeking CNA's and HHA's!,Employer Provided Salary:$13 - $17 Per Hour,"At Visiting Angels Miami:
* You choose your schedule.
* Our clients offer competitive rates.
* We offer referral bonuses.
* You will be part of a great and caring organization.
Requirements:
CNA license or HHA certificate
A minimum of 1 year verifiable experience",3.8,"Visiting Angels
3.8","Miami, FL",10000+ Employees,1998,Company - Private,Health Care Services & Hospitals,Health Care,Unknown / Non-Applicable
27,Home Health Aide (HHA),$23K - $37K (Glassdoor est.),"Join our team and grow with us both professionally and personally!
We strongly believe in providing our employees with great benefits, such as tuition reimbursement, scholarship programs, professional development programs, university partnerships, employee discount program, employee appreciation events, wellness initiatives, and much more!
Acts Home Health (private duty) is currently seeking qualified candidates for the role of Home Health Aide (HHA). Our beautiful, gated communities are located in Boca Raton, FL.
Competitive wages, shift differential, & flexible scheduling! 24/7 On-call support staff available.
Pool positions available for all shifts.
AS810 Home Health - Southern Division",3.4,"Acts Retirement-Life Communities
3.4","Boca Raton, FL",5001 to 10000 Employees,1971,Nonprofit Organization,Social Assistance,Non-Profit,$100 to $500 million (USD)
