,Job Title,Salary Estimate,Job Description,Rating,Company Name,Location,Size,Founded,Type of ownership,Industry,Sector,Revenue
478,"In-Home Caregiver (We train & certify HCA! Apply today, $19-23.45/hr!)",$19 - $22 Per Hour(Employer est.),"Job Overview: Our In-Home Caregiver is the driving force of our company. They bridge the gap between our management team and our clients. Through their service, they give our clients the exceptional care they require to make them feel like part of our family. We recognize the dedication and devotion our caregivers which is why we provide them with ongoing education and ability to advance as they understand what it takes to make an impact.
About the company: villageplan™ is excited to provide holistic and complex care to the geriatric community. Through our in-home health care services, we thrive in delivering family support, professional guidance producing positive outcomes. We continue to offer innovative, client-focused healthcare services in Spokane, Seattle, and surrounding communities with continued success. As we expand, we are seeking talented applicants who share our compassion and believe in our mission to continue to act as advocates in providing expert direction and care to families navigating complex and age-related challenges as we provide care to our seniors.",-1,villageplan™,"King Hill, WA",Unknown,-1,Company - Private,-1,-1,Unknown / Non-Applicable
479,Certified Home Health Aide (CHHA),$19 - $22 Per Hour(Employer est.),"Hospice company seeks motivated hard-working employees for patients in the High Desert area. Duties included, but not limited to: bathing assistance, personal hygiene and grooming, medication reminders, light housekeeping, and assistance with transferring. Job Requirements: -Valid state issued identification and proof of citizenship.-Current CHHA License Current CPR/First Aid Card-Current TB and physical-Must be able to pass a criminal background check-Only applicants with resumes will be considered.
Job Type: Part-time
Pay: $25.00 per hour
Schedule:
Day shift",-1,St. Bernardine Hospice Care,"Apple Valley, CA",-1,-1,-1,-1,-1,-1
480,CNA/PCA/HHA and Caregivers needed,$14 - $18 Per Hour(Employer est.),"Griswold Home Care is seeking exceptional CNA/PCA/HHA/Companions who want to make a difference in the lives of others as a compassionate provider of care! A typical day for you includes supporting the individual with their personal needs by providing companionship, reducing loneliness, assist with bathing, continence/incontinence care, verbal cue’s if memory challenges are present, transporting or running errands, and helping the individual with healthy nutrition. Your goal is to provide for their safety and to help them live as independently as possible in their own home. Our team is here to support you in this mission and provide you with the referrals for clients.
CNA/PCA/HHA/Companion Qualifications our clients are looking for:
1+ year(s) of experience caring for elders.
CNA/PCA certification preferred but not required.",3.9,"Griswold Home Care
3.9","Asheville, NC",1 to 50 Employees,1982,Company - Private,Health Care Services & Hospitals,Health Care,Unknown / Non-Applicable
481,Certified Home Health Aide (Full-time or Part-time),$14 - $18 Per Hour(Employer est.),"New Haven Home Health Services, Inc. is a Medicare certified agency providing skilled home health services to patients at home. We have an immediate opening for full-time or part-time Certified Home Health Aide with at least one year of experience in a home health agency and has provided personal care services in the patient’s home.
Requirements for Certified Home Health Aide:
· Must currently be certified in Home Health Aide by the California State Department of Health
· Willing to visit patients in San Francisco and San Mateo Counties
Preferred Skills for Certified Home Health Aide:
· CHHA must have excellent oral and written communication skills",-1,"New Haven Home Health Services, Inc.","San Francisco, CA",Unknown,-1,Company - Public,-1,-1,Unknown / Non-Applicable
482,Home Care Provider I,$14 - $18 Per Hour(Employer est.),"Are you looking for a way to aid your community in a time of need? Are you an experienced family or independent caregiver looking for training and career advancement opportunities? If yes, then apply now for the Home Care Provider I position with Homebridge.
Under the direction of a Care Supervisor and Manager of Care Teams, Home Care Providers (HCPs) provide in-home caregiving services to aging adults and people with disabilities in San Francisco with complex social and behavioral support needs. By supporting recipients with their activities of daily living in and around their homes, we are making independent living possible, keeping our hospitals and clinics clear. Care providers are essential to addressing our public health crisis.
Better yet, you won't be doing this alone.
Homebridge is an organization working to meet IHSS recipients' needs within the city & county of San Francisco. We prepare care providers to meet those needs with our nationally-recognized training program, tools, and support system to keep our community safe.",-1,Homebridge,"San Francisco, CA",-1,-1,-1,-1,-1,-1
483,"CNA / HCA / NAR Caregiver for Home Health , 12-Hour Shifts",$14 - $18 Per Hour(Employer est.),"Careforce is a private duty and medicaid home care and home health company that's been around for 20 years. Serving King and Snohomish counties, Careforce takes pride in its clinically oriented model of care delivery that sets the standard in caregiving.
In need of caregivers and nurses with great communication, willingness to be self starters, and years of great experience! We employ those with a passion to make a difference in the lives of vulnerable adults throughout the Puget Sound area. If helping others is a part of who you are, then apply with Careforce today! We are a great family owned company that values our employees and are constantly working hard on giving back.
Benefits
Medical Insurance",4.6,"Careforce Inc
4.6","North Bend, WA",51 to 200 Employees,1999,Company - Private,Health Care Services & Hospitals,Health Care,$1 to $5 million (USD)
484,"Resident Assistant/Home Health Aide, FT/PT AM ($1,000 Sign on Bonus)",$14 - $18 Per Hour(Employer est.),"We are looking for Home Health Aides to join our team at Prairie Bluffs Senior Living!
Home Health Aides provide assistance to clients with activities of daily living, such as dressing, grooming, toileting, moving safely to activities or functions, medication assistance and caring for the client's environment.
The ideal candidate for this position has a CNA certificate or equivalent training and Home health aide experience. Must have a genuine desire to work with the elderly and/or disabled. Effective oral and written skills, empathy, the ability to listen, good time management skills, professional speech and behavior are required. Ensures that required documentation is complete and in compliance with regulations and standards.
Job Types: Full-time, Part-time
Pay: $15.00 - $19.00 per hour",1.0,"Prairie Bluffs Senior Living
1.0","Eden Prairie, MN",1 to 50 Employees,-1,Company - Private,Health Care Services & Hospitals,Health Care,$1 to $5 million (USD)
485,Home Health Aide,$14 - $18 Per Hour(Employer est.),"We are actively seeking a full time Certified Home Health Aide to join our rapidly growing clinical team providing best-in-class hospice service to our patients and their families. Be the critical part of our team and make a difference by helping those with life-limiting illness to live their best life.
Responsibilities:
Completes charting and completion of appropriate documentation timely.
Assists patients with bath, mouth care, skin, hair and all aspects of personal hygiene.
Assists patients with transferring and ambulation as needed.
Assists with prescribed exercises which patients and CHHA have been educated in by appropriate health professionals.
Prepares meals and assists patients with eating as required.",-1,Lakeview Hospice Care,"Los Angeles, CA",-1,-1,-1,-1,-1,-1
486,"Certified Home Health Aide (CHHA) $1,000 Sign On Bonus",$14 - $18 Per Hour(Employer est.),"CHHA (Inland Empire and San Gabriel)
Haven Health is a Hospice, Palliative, and Home Health agency in Southern California is hiring a CHHA/HHA. We have established a reputation for providing quality clinical care along with culturally-sensitive support.
Here at Haven, we strive to ensure that our employees feel confident in being able to excel in their positions. We provide hands-on training to ensure every employee is comfortable in accomplishing their assigned tasks and we have an exceptional support system by ensuring all of our Supervisors are readily available to provide guidance.
So if you're ready to help us lay the groundwork for our ever-growing company, then we invite you to join our team! You will have the opportunity to learn and work alongside industry experts who have been in the healthcare field for over 15 years.",-1,Haven Health,"Los Angeles, CA",-1,-1,-1,-1,-1,-1
487,"Certified Nursing Assistant CNA / Home Care Aide HCA $1,500 SIGN-ON BONUS",$14 - $18 Per Hour(Employer est.),"*** We're also offering a $1,500 Sign-On Bonus to eligible CNA's / HCA's! ***
Eden Home Care is hiring Healthcare Heroes!
Eden Health is 100% employee owned company providing services for our community helping them stay safe and healthy in the comfort of their homes. We are currently in 8 states (WA, OR, ID, MT, WY, CA, NV & AZ) which 54% of that growth happened in 2020 and we’re not stopping. What that means for you is there is room to grow and advance your career as far as you’d like just like our Executive Leadership team!
We're hiring Certified Nursing Assistants / CNA / Home Care Aides HCA / in Bozeman, MT and the surrounding area. We currently have Part-Time & Full-Time availability.
WHAT IS IN IT FOR YOU!",4.7,"Eden Health
4.7","Bozeman, MT",1 to 50 Employees,2016,Company - Private,Health Care Services & Hospitals,Health Care,Less than $1 million (USD)
488,In-Home Caregivers SEEKING MORE CONSISTENT HOURS!!!,$14 - $18 Per Hour(Employer est.),"Are you working for another agency or a facility and not getting enough hours?
Are you only getting cases here and there? It is a constant worry if you are not sure if you will be able to pay the bills each month!
What if you could work for a home care agency with over 60 clients and new cases coming in the door daily? We can put you to work RIGHT AWAY!!
Piedmont Home Care is a local, family-owned agency looking for Certified Nursing Assistants to join our growing team! We are the oldest and most respected agency in the Triad and for 51 years , Piedmont Home Care has provided in home care for people in Forsyth county and surrounding areas. We are currently looking for Full-Time and Part-Time CNA's to join our team.
Starting pay is open for negotiation!!",-1,Piedmont Home Care,"Winston-Salem, NC",51 to 200 Employees,-1,Company - Public,-1,-1,Unknown / Non-Applicable
489,Home Health Aide (HHA) / Certified Nursing Assistant (CNA) Job Openings,$14 - $18 Per Hour(Employer est.),"ALC Home Health, a five-start rated home health agency, is one of the largest and most reputable home health company in Miami-Dade & Monroe Counties.
Voted in the top 25% of Home Health Care Companies in the United States by HomeCare Elite, is actively seeking quality Home Health Aids (HHA's), and Certified Nursing Assistants (CNA's) .
Enjoy the numerous benefits and perks of becoming an ALC valued team member such as
· Competitive Compensation and – for Full Time Providers – Strong Benefit Package
· Extremely flexible schedule arrangements, you pick your patients, your area, your hours, you make the decisions!
· Working with one of the top company’s in the industry",1.8,"ALC Home Health
1.8","Miami, FL",1 to 50 Employees,-1,Company - Private,-1,-1,$1 to $5 million (USD)
490,Private Home Caregiver,$14 - $18 Per Hour(Employer est.),"Looking for care/assistance for a successful retirement age businessman. He started from scratch a cattle/farming operation that spans a multi-state area but has had some major setbacks in overall health. He does not want to slow down in everyday life and wants to continue being involved with the family business. He needs assistance with his daily tasks. The job site/home is just south of Overland Park, KS in town of Bucyrus, KS.
He is struggling with his oxygen levels upon exertion. He requires a walker to move around the house and needs assistance getting up out of a chair. He is very quick-witted with an ornery personality. He enjoys having fun with others. Caregiver must have some thick skin and be willing to handle some of his moments of being frustrated with his current condition.
You will be tasked with helping the patient with personal hygiene, minor medical needs, housekeeping, and other daily needs as required by the patient. To excel in this role, you should have an interest in health care as well as an interest in the patient's happiness/well-being. We are looking for a caring individual who has the ability to work with limited supervision while keeping the patient's needs as your top priority.",-1,Foote Cattle Company,"Bucyrus, KS",201 to 500 Employees,-1,Company - Private,-1,-1,Unknown / Non-Applicable
491,Certified Home Health Aide (CHHA),$14 - $18 Per Hour(Employer est.),"Harmony Home Health seeks a Per-Diem Certified Home Health Aide to join its dynamic team of healthcare professionals in the Contra Costa County, East Bay, Daly City, Half Moon Bay, Peninsula, San Francisco, San Mateo, Santa Clara, Pleasant Hill and Richmond areas. Harmony Home Health is Medicare-Certified and State-Licensed.
The responsibilities of the Certified Home Health Aide include:
Providing personal care according to the care plan or as directed by RN, PT, OT: Baths, Back rubs, Oral hygiene, Shampoos, Changing bed linen, Assisting patients with dressing and undressing, Skin care to prevent breakdown, Assisting the patient with toileting activities, Keeping patient’s living area clean and orderly, as appropriate
Assisting in feeding the patient, if necessary.
Taking and recording oral, rectal and axillary temperatures, pulse, respiration and blood pressure when ordered (with appropriate completed/demonstrated skills competency).",-1,Harmony Home Health,"San Francisco, CA",Unknown,-1,Company - Private,-1,-1,Unknown / Non-Applicable
492,Home Health Aide,$14 - $18 Per Hour(Employer est.),"CAREGIVER
$900 Hiring Bonuses
YOUR REWARDS
Competitive Wages & Salaries
Flexible Work Schedules
Hiring Cash Bonuses
Unlimited Referral Cash Bonuses
Tuition Discounts
Paid Time Off",3.5,"Attention Plus Care
3.5","Honolulu, HI",51 to 200 Employees,-1,Company - Private,Health Care Services & Hospitals,Health Care,$1 to $5 million (USD)
493,Caregivers - Home Health Aides & CNAs,$14 - $18 Per Hour(Employer est.),"Visiting Angels is looking for compassionate and reliable caregivers - CNA’s, HHA’s and PCA’s - to join its team and assist clients with personal care, companionship, escort, transfer, feeding, medication reminder, light housekeeping, meal preparation, engaging in stimulating conversation and activities with the client etc.
SKILLS, PERSONAL ABILITIES & QUALIFICATIONS
· Home Health Aide certificate or CNA license
· One-year experience as HHA, CNA or PCA
· Fluency in English and ability to listen and communicate clearly
· Ability to behave with respect and compassion",-1,Visiting Angels,"Raynham, MA",-1,-1,-1,-1,-1,-1
494,"Resident Care Associate (CNA,HHA,LNA)",$14 - $18 Per Hour(Employer est.),"Hampton, New Hampshire
Resident Care Associate (LNA, MNA, CNA, HHA)
Cornerstone at Hampton in Hampton, NH is hiring caring and compassionate Certified Nursing Assistants, Licensed Nursing Assistants, and Home Health Aides to serve as Resident Care Associates. Our Resident Care Associates provide direct care to seniors, are committed to providing a safe home-like environment, have a passion for helping others, and enjoy having fun!

Learn more about our community here.
Available Shifts
7am-3pm (Full Time, Part Time, Per Diem)
3pm-11pm (Full Time, Part Time, Per Diem)
11pm-7am (Full Time, Part Time, Per Diem)

Don’t see a shift opening that matches your needs? We may have flexible hours and schedules available, which is great for students, mother’s hours, and retirees! Apply to find out more about our flexible schedules!",4.1,"Senior Living Residences
4.1","Hampton, NH",1001 to 5000 Employees,1990,Company - Private,Health Care Services & Hospitals,Health Care,$10 to $25 million (USD)
495,Physical Therapist Aide for Home Health,$14 - $18 Per Hour(Employer est.),"What You Will Do:
As a home health physical therapist, you will provide one on one treatment and care to patients in their home using a comprehensive and patient specific care plan, innovative solutions, and a preferred technology for point of care documentation. You will have the opportunity to spend quality time with the patient, in their own home, to promote their health and independence. You will have autonomy in addition to the support and collaboration of a full team of healthcare professionals.
Collaborate with physicians, patients and their families, nurses, therapists, social workers and other members of the patient care team to develop and implement a patient specific care and treatment plan
Cooperatively utilize varied solutions to educate and promote the health and independence of the patient",-1,Gentle Shepherd Home Health Care,"Oklahoma City, OK",51 to 200 Employees,-1,Company - Public,Health Care Services & Hospitals,Health Care,Unknown / Non-Applicable
496,In Home Care Provider,$14 - $18 Per Hour(Employer est.),"Ask about our $600 New Hire Retention & $100 Vaccine Bonuses!
Hiring for all shifts- flexible hours. OT available!
Do you want a job where you can literally change the world, one person's world at a time? You just found it!
As a Home Instead of Surprise Caregiver you will assist seniors with a variety of activities in the senior's home. You will assist with everything from chores around the house to bathing or toileting. See below for job description.
We have a compact service area, so do not send Caregivers all over the valley and we have a strong emphasis on respecting and supporting our Caregivers. In fact, half of our dozen+ office staff started with us as Caregivers and our Caregiver satisfaction hovers around 85% (so does our client satisfaction)!",-1,Home Instead of Surprise,"Surprise, AZ",-1,-1,-1,-1,-1,-1
497,Weekend Private Duty Caregiver- Immediate Hiring,$14 - $18 Per Hour(Employer est.),"Do you want to make a difference in someone’s life? Join our team of HEALTH CARE HEROES!
We are a locally owned and managed Private Duty Company that treats our caregivers like family. With Always There Health Care, you will get the training and education you need to advance your skills. Always There treats our employees exactly the way we want our caregivers to treat our clients, with Respect, Compassion, and Consistent Care that’s “Always There”.
Appreciation Perks:
o Health Insurance (Medical, Vision & Dental)
o Paid Time Off
o Competitive Pay",-1,Always There Health Care servicing the Kansas City Metro,"Overland Park, KS",-1,-1,-1,-1,-1,-1
498,HHA needed FT flexible schedule day shift 1/1 care,$14 - $18 Per Hour(Employer est.),"The Certified Home Health Aide is a non-exempt employee trained to provide personal care and services to the terminally ill to augment that care given by family members. Functions under the direct instruction and supervision of the VITAS nurse and/or the VITAS Team Manager.
QUALIFICATIONS
Qualified candidates must have one (1) year direct patient care experience in acute or sub acute care.
Good documentation skills required.
Ability to travel per job requirement.
EDUCATION",-1,VITAS Healthcare,"Melbourne, FL",10000+ Employees,1978,Subsidiary or Business Segment,Health Care Services & Hospitals,Health Care,$1 to $2 billion (USD)
499,"We have all the shifts you need, Short/Long Shifts HHA/CNA, $13+",$14 - $18 Per Hour(Employer est.),"***We provide all Personal protective equipment to perform your job***
Home Care Assistance is the nation's leading provider of premium in-home care and a great company to start or accelerate your career. In every community we serve, our local care team is ready to assist our clients and our caregivers. That means you'll get the professional support and guidance you need 24/7.
You will be providing one on one care with patients in the comfort of their own homes. We assist with all activities of daily living. Provide transportation, companionship, patient advocacy, and household management.
Requirements:
Must have compassion, dependability and be a hard worker",-1,Home Care Assistance Orlando,"Orlando, FL",-1,-1,-1,-1,-1,-1
500,"HHA, PCA, CNA",$14 - $18 Per Hour(Employer est.),"CNA
Flourish is a new contemporary senior living community in Golden Valley. We believe home matters and seniors deserve better care options that fit their means and are simple to understand and accommodate changing needs. The CNA provides home care, health services and personal care needs to residents based on their plan of care. This position will assist residents with their daily living, helping with bathing, dressing, grooming, light housekeeping, laundry, and assistance with dining. As part of the Flourish team, the CNA/PCA/HHA will assist in helping to create and maintain an environment that achieves the highest quality of care of resident’s physical, emotional, mental and social well being.
QUALIFICATIONS:
Current CNA Certificate preferred.",5.0,"Flourish Senior Living
5.0","Golden Valley, MN",1 to 50 Employees,-1,Company - Private,Real Estate,Real Estate,Unknown / Non-Applicable
501,Caregivers! All Shifts Available! Weekly Pay!,$14 - $18 Per Hour(Employer est.),"Want to make an impact in the daily lives of others? Cambrian Homecare is an excellent setting to start a career in healthcare or to find yourself making a difference in the lives of the aging, injured or developmentally disabled.
As a Caregiver working with seniors, you will be help them complete their day to day tasks and ensuring their safety in the comfort of their home. This is a great opportunity for caring people to feel proud about doing important work in the community, helping those who cannot always do for themselves.
Don’t have the experience? We provide a high quality virtual & in-person training!
Apply now or call our recruiter to schedule a virtual interview at (866) 650-4300!
$200 Sign on bonus!",3.3,"Cambrian Homecare - Long Beach
3.3","Downey, CA",51 to 200 Employees,1996,Company - Private,"Health, Beauty, & Fitness",Consumer Services,$5 to $10 million (USD)
502,"Certified Home Health Aide - Hospice - $1,500 sign-on bonus! Virtual Hiring Event",$14 - $18 Per Hour(Employer est.),"$1,500 Sign-On Bonus!

Providence is calling a Certified Home Health Aide - Hospice (Full time/Day Shift) to Providence TrinityCare Hospice in Torrance and Cerritos, CA.

We are seeking a Certified Home Health Aide - Hospice who will work under the supervision of a Registered Nurse and the Continuous Care Clinical Supervisor. The Continuous Care Hospice CHHA will perform various services for a patient as is necessary to meet the patient's personal needs and to promote comfort following the CHHA plan of care developed by the registered nurse in collaboration with the interdisciplinary team/group (IDG). The Continuous Care Hospice Certified Home Health Aide will be responsible for observing the patient, reporting these observations and documenting observations and care performed. The Continuous Care Hospice Certified Home Health Aide will be assigned to provide continuous nursing care to the patient during times of medical crisis, as directed in the Plan of Care, in a manner that promotes the quality, continuity and safety of a patient's care. The Continuous Care Certified Home Health Aide will be available for a minimum of 16 hours a week for continuous care assignments. May provide care to premature infants, infants, pediatrics, adolescents, young, middle and young adults.",-1,Providence,"Redondo Beach, CA",10000+ Employees,1855,Nonprofit Organization,Health Care Services & Hospitals,Health Care,$100 to $500 million (USD)
503,CNA PCA HHA or RA,$14 - $18 Per Hour(Employer est.),"No experience? No worries!! 40 hrs hands on training and certifications
Attention to detail
Reliable
Compassionate
If this sounds like you, join our team of professionals to provide excellent care for our elderly residents. Every pay period we offer Attendance bonuses, pick-up bonuses, weekend bonuses, shift differentials and more.
Part-time hours: 24-40 per week
Job Types: Full-time, Part-time",2.6,"The Home of the Good Shepherd
2.6","Saratoga Springs, NY",201 to 500 Employees,1870,Company - Private,Health Care Services & Hospitals,Health Care,Unknown / Non-Applicable
