,Job Title,Salary Estimate,Job Description,Rating,Company Name,Location,Size,Founded,Type of ownership,Industry,Sector,Revenue
741,"CHHA, Home Health Per Diem - Downey/Whittier/Long Beach",$22 Per Hour(Employer est.),"We are a home health agency in Santa Ana, CA, seeking per diem Certified Home Health Aides (CHHAs) to join our team, to cover for the following California area: DOWNEY, WHITTIER, LONG BEACH
JOB DUTIES AND RESPONSIBILITIES:
ESSENTIAL FUNCTIONS:
Gives or assists with bathing, dressing, oral hygiene, hair treatments, nails and skin care.
Assists with positioning, transfers and ambulation, with or without assistive devices.
Assists patient with prescribed range of motion and prescribed exercise which patient and aide have been taught by designated professional personnel.
Assists with application of non-prescription topical ointments.",4.3,"Care Dimensions, LLC
4.3","Downey, CA",501 to 1000 Employees,1978,Nonprofit Organization,Health Care Services & Hospitals,Health Care,$25 to $50 million (USD)
742,"Certified Home Health Aide - Hospice - $1,500 sign-on bonus! Virtual Hiring Event",$22 Per Hour(Employer est.),"$1,500 Sign-On Bonus!

Providence is calling a Certified Home Health Aide - Hospice (Full time/Day Shift) to Providence TrinityCare Hospice in Torrance and Cerritos, CA.

We are seeking a Certified Home Health Aide - Hospice who will work under the supervision of a Registered Nurse and the Continuous Care Clinical Supervisor. The Continuous Care Hospice CHHA will perform various services for a patient as is necessary to meet the patient's personal needs and to promote comfort following the CHHA plan of care developed by the registered nurse in collaboration with the interdisciplinary team/group (IDG). The Continuous Care Hospice Certified Home Health Aide will be responsible for observing the patient, reporting these observations and documenting observations and care performed. The Continuous Care Hospice Certified Home Health Aide will be assigned to provide continuous nursing care to the patient during times of medical crisis, as directed in the Plan of Care, in a manner that promotes the quality, continuity and safety of a patient's care. The Continuous Care Certified Home Health Aide will be available for a minimum of 16 hours a week for continuous care assignments. May provide care to premature infants, infants, pediatrics, adolescents, young, middle and young adults.",-1,Providence,"Redondo Beach, CA",10000+ Employees,1855,Nonprofit Organization,Health Care Services & Hospitals,Health Care,$100 to $500 million (USD)
743,Caregiver Companion Care In home care giver for seniors,$22 Per Hour(Employer est.),"Job Description
We are looking for compassionate caregivers with flexible hours, to care for our clients in a professional and compassionate manner. The ideal candidate will be patient and friendly with excellent communication skills. You should be able to follow instructions and perform a variety of tasks to help clients.
Experience and CNAs a plus, but not a must.
Responsibilities
· Companion Care and Mental Stimulation
- Remind clients to take medication",-1,Home Care Services of the Carolinas,"Asheville, NC",1 to 50 Employees,-1,Company - Private,Health Care Services & Hospitals,Health Care,Unknown / Non-Applicable
744,Caregiver/CNA/HHA - ALL SHIFTS,$22 Per Hour(Employer est.),"If you are passionate about helping people in their home, respecting their dignity, and providing quality care, TRUST HomeCare is looking for you! TRUST is always looking for qualified, empathetic people with the utmost character and integrity.
FULL TIME or PART TIME NEEDED!
FLEXIBLE HOURS and OPPOURTUNITIES FOR OVERTIME
WE WILL WORK WITH YOUR SCHEDULE
HEALTH, DENTAL, and VISION INSURANCE BENEFITS
NO EXPERIENCE or CERTIFICATIONS ARE REQUIRED - ON THE JOB TRAINING IS PROVIDED
At TRUST HomeCare we accept many different clients who all have a variety of needs for you to assist with. Caregivers at TRUST HomeCare can expect to assist with things like light housekeeping, meal preparation, medication reminders, personal hygiene, bathing, grooming, and mobility.",-1,"TRUST HomeCare, LLC","Newton, KS",Unknown,-1,Company - Private,-1,-1,Unknown / Non-Applicable
745,Extraordinary Companion! - No CNA/HHA license required,$22 Per Hour(Employer est.),"Join our 100% Covid 19 vaccinated team!
Innovative Home Care is hiring Companions to work for the best senior residents in the world! Our beautiful campus sits right on Lake Seminole. Come work private duty with our residents in a clean, safe, and family-friendly atmosphere. Choose your own hours and build your own Full time or Part time schedule. We offer medical, dental, and vision insurance as well as a matching 401k. If you have a passion for working with seniors, look no further and come work at Lake Seminole Square!
Job Types: Full-time, Part-time
Pay: $10.00 per hour
Benefits:",-1,Innovative Home Services,"Seminole, FL",-1,-1,-1,-1,-1,-1
746,Certified Home Health Aides (HHA) 5K Sign on Bonus,$22 Per Hour(Employer est.),"$5,000 Sign on Bonus!!!
Certified Home Health Aides
Argyle Assisted Living Program is actively seeking motivated Certified Home Health Aides for all shifts for our Assisted Living Facility in Argyle, NY.
Argyle Center Assisted Living Program offers the following benefits and more:
Tuition Reimbursement Program
Generous pay rates based on experience
Extra evening and night shift differentials
Flexible schedules for Full-Time, Part-Time, or Per-Diem status
Career Advancement Opportunities",4.5,"Centers Health Care
4.5","Saratoga Springs, NY",5001 to 10000 Employees,2001,Company - Private,Health Care Services & Hospitals,Health Care,Unknown / Non-Applicable
747,Caregiver/ Home Care Aide - Beverly Hills,$22 Per Hour(Employer est.),"Interim Healthcare is actively hiring Caregivers that desire to work overnight for a client in Beverly Hills. Please only apply if you are seriously interested in the role and have the required qualifications, experience and skill set.
We are seeking a highly skilled and experienced Caregiver to provide the absolute best level of care and comfort for our clients in Beverly Hills.
You must have the strength to do a lot of transferring to/from wheelchair for a high fall risk client. Schedule will be overnight, (exact time TBD), 9-10 hour shift, during the weekdays. Primary responsibilities will included transferring client, assistance with toileting throughout the night, and being an ambulation attendant in moving around, ensuring client doesn't fall.
Responsibilities include, but not limited to are:",-1,Interim HealthCare of Santa Monica,"Beverly Hills, CA",-1,-1,-1,-1,-1,-1
748,CNA PCA HHA or RA,$22 Per Hour(Employer est.),"No experience? No worries!! 40 hrs hands on training and certifications
Attention to detail
Reliable
Compassionate
If this sounds like you, join our team of professionals to provide excellent care for our elderly residents. Every pay period we offer Attendance bonuses, pick-up bonuses, weekend bonuses, shift differentials and more.
Part-time hours: 24-40 per week
Job Types: Full-time, Part-time",2.6,"The Home of the Good Shepherd
2.6","Saratoga Springs, NY",201 to 500 Employees,1870,Company - Private,Health Care Services & Hospitals,Health Care,Unknown / Non-Applicable
749,"Caregiver/Home Health Aide~(Arapahoe County, Co) **Bonus Available**",$22 Per Hour(Employer est.),"COMPLETE VETTING FOR THIS PROGRAM BY NOVEMBER 30th AND RECEIVE A $200 BONUS!
CareLinx and several large health plans are partnering to provide thousands of members with in-home care benefits starting in 2022! As a caregiver, you will be assisting members with their daily activities and needs and providing support to them in their homes and communities. This work is pivotal and provides important insights to help improve the overall health of these members. Our programs with these members will be running for at least a year, which provides steady work opportunities with competitive pay to reliable and professional caregivers! Space is limited! We need caregivers as soon as possible for work to begin in January 2022. [Space in the program is limited, so take advantage of this great opportunity today.]
* If you successfully complete vetting and training for the program, you will be eligible for exciting raffle prizes and giveaways including:",4.3,"CareLinx
4.3","Littleton, CO",1 to 50 Employees,2012,Company - Private,Health Care Services & Hospitals,Health Care,$5 to $10 million (USD)
750,Home Health Aide,$30 - $35 Per Hour(Employer est.),"Home Health Aide (HHA)
National Home Health is a leading provider of in-home healthcare in Northern California with accreditation through the Joint Commission of Accreditation of Healthcare Organizations. At this time we are looking for a full-time/part-time California Certified Home Health Aide (HHA) in:
Location: San Rafael, Novato, Petaluma, and surrounding areas
Compensation: $-30-35/ per visit
Position Qualifications include but are not limited to the following:
Home Health Aide certification was obtained through the successful completion of a program approved by the California Department of Public Health. Certification must be current with the California Department of Public Health Licensing and Certification Division. Applicants without this license will not be considered for employment (Please visit: http://cvl.cdph.ca.gov/SearchPage.aspx to verify certification).",4.0,"National Home Health Services
4.0","Novato, CA",1 to 50 Employees,2009,Company - Public,Health Care Services & Hospitals,Health Care,Less than $1 million (USD)
751,"CNA / HCA / NAR Caregiver for Home Health , 12-Hour Shifts",$30 - $35 Per Hour(Employer est.),"Careforce is a private duty and medicaid home care and home health company that's been around for 20 years. Serving King and Snohomish counties, Careforce takes pride in its clinically oriented model of care delivery that sets the standard in caregiving.
In need of caregivers and nurses with great communication, willingness to be self starters, and years of great experience! We employ those with a passion to make a difference in the lives of vulnerable adults throughout the Puget Sound area. If helping others is a part of who you are, then apply with Careforce today! We are a great family owned company that values our employees and are constantly working hard on giving back.
Benefits
Medical Insurance",4.6,"Careforce Inc
4.6","North Bend, WA",51 to 200 Employees,1999,Company - Private,Health Care Services & Hospitals,Health Care,$1 to $5 million (USD)
752,CNA/PCA/HHA and Caregivers needed,$30 - $35 Per Hour(Employer est.),"Griswold Home Care is seeking exceptional CNA/PCA/HHA/Companions who want to make a difference in the lives of others as a compassionate provider of care! A typical day for you includes supporting the individual with their personal needs by providing companionship, reducing loneliness, assist with bathing, continence/incontinence care, verbal cue’s if memory challenges are present, transporting or running errands, and helping the individual with healthy nutrition. Your goal is to provide for their safety and to help them live as independently as possible in their own home. Our team is here to support you in this mission and provide you with the referrals for clients.
CNA/PCA/HHA/Companion Qualifications our clients are looking for:
1+ year(s) of experience caring for elders.
CNA/PCA certification preferred but not required.",3.9,"Griswold Home Care
3.9","Asheville, NC",1 to 50 Employees,1982,Company - Private,Health Care Services & Hospitals,Health Care,Unknown / Non-Applicable
753,"Now Hiring CNAs and HHAs: Flexible schedules, Free Training & 401K",$30 - $35 Per Hour(Employer est.),"Always Best Care Jacksonville is Seeking Experienced Caregivers for Clay, Duval, and St Johns Counties!
Since 1996, Always Best Care has helped thousands of families with non-medical in-home care and assisted living referral services. In select markets, we provide skilled home care for clients that need the services of our exceptional clinical care team.
Our passion for helping people maintain a safe, independent and dignified lifestyle represents the strong foundation of Always Best Care. Every client receives extraordinary care in an inspiring environment with caring and compassionate people.
Our future employees have a minimum of one year experience care giving, excellent communication skills, personal care experience with seniors and a heart for working with seniors. The main function of the caregivers is to provide care for clients in a safe, secure, professional environment which meets their needs.",-1,Always Best Care Senior Services of Jacksonville,"Jacksonville, FL",-1,-1,-1,-1,-1,-1
754,"Certified Home Health Aide (CHHA) $1,000 Sign On Bonus",$30 - $35 Per Hour(Employer est.),"CHHA (Inland Empire and San Gabriel)
Haven Health is a Hospice, Palliative, and Home Health agency in Southern California is hiring a CHHA/HHA. We have established a reputation for providing quality clinical care along with culturally-sensitive support.
Here at Haven, we strive to ensure that our employees feel confident in being able to excel in their positions. We provide hands-on training to ensure every employee is comfortable in accomplishing their assigned tasks and we have an exceptional support system by ensuring all of our Supervisors are readily available to provide guidance.
So if you're ready to help us lay the groundwork for our ever-growing company, then we invite you to join our team! You will have the opportunity to learn and work alongside industry experts who have been in the healthcare field for over 15 years.",-1,Haven Health,"Los Angeles, CA",-1,-1,-1,-1,-1,-1
755,Home Health Aide,$30 - $35 Per Hour(Employer est.),"CAREGIVER
$900 Hiring Bonuses
YOUR REWARDS
Competitive Wages & Salaries
Flexible Work Schedules
Hiring Cash Bonuses
Unlimited Referral Cash Bonuses
Paid Time Off
Paid Training",3.5,"Attention Plus Care
3.5",United States,51 to 200 Employees,-1,Company - Private,Health Care Services & Hospitals,Health Care,$1 to $5 million (USD)
756,Resident Assistant,$30 - $35 Per Hour(Employer est.),"Overview:
Part Time - Resident Assistant - Day, Evening, or Overnight Shifts - Hutchinson, MN

Walk-In Open Interviews
Every Wednesday from 1pm-4pm
Address: 945 Century Ave SW, Hutchinson MN 55350

Want to work for a company that cares? Put your passion for serving others to work as a Resident Assistant at Ecumen Oaks & Pines in Hutchinson, Minnesota!
We’re hiring caring, compassionate people like you to provide personal care and health-related services to help make the lives of our residents more fulfilling and enjoyable. As a caregiver at Ecumen, you’ll put people at the heart of what you do and find new ways to exceed people’s expectations every day.
Responsibilities:









Qualifications:
Equal Opportunity Employer:",3.5,"Ecumen
3.5","Hutchinson, MN",1001 to 5000 Employees,1863,Nonprofit Organization,Health Care Services & Hospitals,Health Care,$100 to $500 million (USD)
757,Private In-Home Nursing Caregiver for 1 Patient,$30 - $35 Per Hour(Employer est.),"Job Description
In-home patient care to elderly female
Light housekeeping duties
Qualifications
Successful completion of a state-approved CNA program and current certification required
High school diploma or equivalency diploma required
Experience caring for geriatric patients required
Experience caring for dementia patients desired",-1,Keith Household,"Rutland, VT",-1,-1,-1,-1,-1,-1
758,Home Care Aide,$30 - $35 Per Hour(Employer est.),"Home Care Aide
$14/hour
Aloha!
We are a local Home Care Agency looking for Home Care Aides!
At PK CARE LLC, our mission is to improve lives through dedicated care. Please do not apply if your main purpose is to find any job that will get you by in the short term. But if you are passionate about providing care and are willing to make a positive impact on the lives of those you care for, we want YOU on our team.”
Caregiver duties and responsibilities can include:",-1,PK Care LLC,"Ewa Beach, HI",-1,-1,-1,-1,-1,-1
759,"Certified Nursing Assistant CNA / Home Care Aide HCA $1,500 SIGN-ON BONUS",$30 - $35 Per Hour(Employer est.),"*** We're also offering a $1,500 Sign-On Bonus to eligible CNA's / HCA's! ***
Eden Home Care is hiring Healthcare Heroes!
Eden Health is 100% employee owned company providing services for our community helping them stay safe and healthy in the comfort of their homes. We are currently in 8 states (WA, OR, ID, MT, WY, CA, NV & AZ) which 54% of that growth happened in 2020 and we’re not stopping. What that means for you is there is room to grow and advance your career as far as you’d like just like our Executive Leadership team!
We're hiring Certified Nursing Assistants / CNA / Home Care Aides HCA / in Bozeman, MT and the surrounding area. We currently have Part-Time & Full-Time availability.
WHAT IS IN IT FOR YOU!",4.7,"Eden Health
4.7","Bozeman, MT",1 to 50 Employees,2016,Company - Private,Health Care Services & Hospitals,Health Care,Less than $1 million (USD)
760,"We have all the shifts you need, Short/Long Shifts HHA/CNA, $13+",$30 - $35 Per Hour(Employer est.),"***We provide all Personal protective equipment to perform your job***
Home Care Assistance is the nation's leading provider of premium in-home care and a great company to start or accelerate your career. In every community we serve, our local care team is ready to assist our clients and our caregivers. That means you'll get the professional support and guidance you need 24/7.
You will be providing one on one care with patients in the comfort of their own homes. We assist with all activities of daily living. Provide transportation, companionship, patient advocacy, and household management.
Requirements:
Must have compassion, dependability and be a hard worker",-1,Home Care Assistance Orlando,"Orlando, FL",-1,-1,-1,-1,-1,-1
761,Weekend Private Duty Caregiver- Immediate Hiring,$30 - $35 Per Hour(Employer est.),"Do you want to make a difference in someone’s life? Join our team of HEALTH CARE HEROES!
We are a locally owned and managed Private Duty Company that treats our caregivers like family. With Always There Health Care, you will get the training and education you need to advance your skills. Always There treats our employees exactly the way we want our caregivers to treat our clients, with Respect, Compassion, and Consistent Care that’s “Always There”.
Appreciation Perks:
o Health Insurance (Medical, Vision & Dental)
o Paid Time Off
o Competitive Pay",-1,Always There Health Care servicing the Kansas City Metro,"Overland Park, KS",-1,-1,-1,-1,-1,-1
762,Caregivers! All Shifts Available! Weekly Pay!,$30 - $35 Per Hour(Employer est.),"Want to make an impact in the daily lives of others? Cambrian Homecare is an excellent setting to start a career in healthcare or to find yourself making a difference in the lives of the aging, injured or developmentally disabled.
As a Caregiver working with seniors, you will be help them complete their day to day tasks and ensuring their safety in the comfort of their home. This is a great opportunity for caring people to feel proud about doing important work in the community, helping those who cannot always do for themselves.
Don’t have the experience? We provide a high quality virtual & in-person training!
Apply now or call our recruiter to schedule a virtual interview at (866) 650-4300!
$200 Sign on bonus!",3.3,"Cambrian Homecare - Long Beach
3.3","Downey, CA",51 to 200 Employees,1996,Company - Private,"Health, Beauty, & Fitness",Consumer Services,$5 to $10 million (USD)
763,Home Health Aide,$30 - $35 Per Hour(Employer est.),"Infinity Care Services, Inc. Home Health & Hospice, is looking for a Home Health Aide (HHA) in Stanislaus Counties. As an HHA, you will be delivering the highest quality patient care, according to the specific orders of each patient’s physician.
Job Requirements:
Assist with activities of daily living such as: bathing, grooming, oral care, dressing, undressing, toileting activities, transfers, feeding, meal preparation, linen changes, light housekeeping, and laundry
Monitor vital signs including temperature, pulse, respiration and blood pressure
Assist with range of motion exercises as defined in the plan of care
Assist with walking and transportation to doctor appointments, grocery store, and shopping",4.0,"Infinity Care Services, Inc. Home Health & Hospice
4.0","Stanislaus, CA",51 to 200 Employees,2009,Company - Private,Health Care Services & Hospitals,Health Care,Unknown / Non-Applicable
764,In-Home Caregivers SEEKING MORE CONSISTENT HOURS!!!,$30 - $35 Per Hour(Employer est.),"Are you working for another agency or a facility and not getting enough hours?
Are you only getting cases here and there? It is a constant worry if you are not sure if you will be able to pay the bills each month!
What if you could work for a home care agency with over 60 clients and new cases coming in the door daily? We can put you to work RIGHT AWAY!!
Piedmont Home Care is a local, family-owned agency looking for Certified Nursing Assistants to join our growing team! We are the oldest and most respected agency in the Triad and for 51 years , Piedmont Home Care has provided in home care for people in Forsyth county and surrounding areas. We are currently looking for Full-Time and Part-Time CNA's to join our team.
Starting pay is open for negotiation!!",-1,Piedmont Home Care,"Winston-Salem, NC",51 to 200 Employees,-1,Company - Public,-1,-1,Unknown / Non-Applicable
765,Home Health Aide/CNA,$30 - $35 Per Hour(Employer est.),"Being a home health aide with Interim Healthcare means you get to build relationships with your clients, as you provide cares that enable them to stay healthy in their own homes. You let us know the hours you want to work and we build a schedule around YOUR availability!
We are looking for a compassionate Home Health Aide to provide assistance in daily living and personal care services in patients homes in accordance with an established care plan.
Responsibilities
Provide health care services in patients residences
Perform domestic and household tasks
Transport and accompany patients to doctors office or to hospital",-1,Interim HealthCare of the Black Hills,"Rapid City, SD",-1,-1,-1,-1,-1,-1
766,"In-Home Caregiver (We train & certify HCA! Apply today, $19-23.45/hr!)",$30 - $35 Per Hour(Employer est.),"Job Overview: Our In-Home Caregiver is the driving force of our company. They bridge the gap between our management team and our clients. Through their service, they give our clients the exceptional care they require to make them feel like part of our family. We recognize the dedication and devotion our caregivers which is why we provide them with ongoing education and ability to advance as they understand what it takes to make an impact.
About the company: villageplan™ is excited to provide holistic and complex care to the geriatric community. Through our in-home health care services, we thrive in delivering family support, professional guidance producing positive outcomes. We continue to offer innovative, client-focused healthcare services in Spokane, Seattle, and surrounding communities with continued success. As we expand, we are seeking talented applicants who share our compassion and believe in our mission to continue to act as advocates in providing expert direction and care to families navigating complex and age-related challenges as we provide care to our seniors.",-1,villageplan™,"King Hill, WA",Unknown,-1,Company - Private,-1,-1,Unknown / Non-Applicable
767,"CHHA, Home Health Per Diem - Downey/Whittier/Long Beach",$30 - $35 Per Hour(Employer est.),"We are a home health agency in Santa Ana, CA, seeking per diem Certified Home Health Aides (CHHAs) to join our team, to cover for the following California area: DOWNEY, WHITTIER, LONG BEACH
JOB DUTIES AND RESPONSIBILITIES:
ESSENTIAL FUNCTIONS:
Gives or assists with bathing, dressing, oral hygiene, hair treatments, nails and skin care.
Assists with positioning, transfers and ambulation, with or without assistive devices.
Assists patient with prescribed range of motion and prescribed exercise which patient and aide have been taught by designated professional personnel.
Assists with application of non-prescription topical ointments.",4.3,"Care Dimensions, LLC
4.3","Downey, CA",501 to 1000 Employees,1978,Nonprofit Organization,Health Care Services & Hospitals,Health Care,$25 to $50 million (USD)
768,Private Duty HHA Virtual Hiring Event,$30 - $35 Per Hour(Employer est.),"Morning and evening shifts available,
Start Times are 6am, 9am, 12pm, 3pm and 6pm, shift duration is 1-5 hours.
We have positions available in different locations throughout the Pinellas County area.

Empath For You is currently seeking a Private Duty Home Health Aide who will be responsible for providing personal care and tasks related to the activities of daily living. The Private Duty Aide should be able to respond sensitively to patient/family needs by observing and reporting any changes, including physical, spiritual, social and emotional, to the Private Duty Manager.


Requirements",3.7,"Empath Health
3.7","Tampa, FL",1001 to 5000 Employees,1977,Nonprofit Organization,Health Care Services & Hospitals,Health Care,Unknown / Non-Applicable
