,Job Title,Salary Estimate,Job Description,Rating,Company Name,Location,Size,Founded,Type of ownership,Industry,Sector,Revenue
737,Therapist,$68K - $110K (Employer est.),"Licensed Therapist (California)
Licensed - Therapist - LMFT, LCSW, Psy.D. / Ph.D, or Clinical Social Worker
Change Within Reach is a mental health clinic providing psychotherapy services to a wide array of clients. We offer opportunities to work with children, adolescents, teens, and adults of all ages.
We serve culturally diverse populations of various socio-economic backgrounds and age groups. Change Within Reach will provide you with as many clients as you need, we are extremely busy. Our culture and values guide how we work and treat one another. Change Within Reach celebrates diversity and fosters an inclusive environment, seeking ideas and opinions from everyone on the team.
We are currently hiring ONLY California LICENSED clinicians - Licensed Clinical Social Workers (LCSWs), Licensed Marriage and Family Therapists (LMFTs) and Licensed Clinical Psychologists (Ph.D/Psy.D). to provide psychotherapy services via telehealth. Both part time and full time positions are available.",-1,"Change Within Reach, Inc.",Remote,-1,-1,-1,-1,-1,-1
738,Licensed Marriage and Family Therapist,$68K - $110K (Employer est.),"Licensed Marriage and Family Therapist Intern LMFTI – Job Post
Evolving Reflections
Urgently Hiring
Full Job Description
LMFTI Licensed Marriage and Family Therapist Intern
Job Description
I am looking for a passionate, energetic, and caring team member to join our team! I am seeking a part-time or full-time LMFTI Licensed Marriage and Family Therapist Intern or CPC Certified Professional Counselor to help clients face life challenges. Compensation is based on total experience.",-1,Evolving Reflections,"Las Vegas, NV",-1,-1,-1,-1,-1,-1
739,Mental Health Therapist - Permanently Remote,$68K - $110K (Employer est.),"Welcome to Foresight Mental Health. We're so glad you're considering joining our team.
More support and innovative tools for better care
As a provider with Foresight, we want you to focus on what's most important - treating and caring for our members. Which is why we have a team dedicated to handling all the administrative aspects of therapy: credentialing, scheduling, billing and marketing. This extended support gives you the time and space you need to be present and engaged with our members.
You'll also enjoy support from your colleagues during small-group case consultation weekly meetings. These location-based groups are an intimate way to collaborate with other therapists and build community and camaraderie.
And with our in-house bioengineers and software developers, we've created a suite of care-enhancing tools meant to empower you with additional data and insights to better inform your approach.",4.8,"Foresight Mental Health
4.8","Chicago, IL",201 to 500 Employees,2018,Company - Private,Health Care Services & Hospitals,Health Care,Unknown / Non-Applicable
740,Outpatient Therapist,$68K - $110K (Employer est.),"Outpatient Therapist Role:
About Us:
Collaborative Modern Outpatient Therapist Private Practice in Stoughton, MA and Dedham, MA
We are a team of practitioners who provide psychotherapy and medication management to individuals and families.
All of our clinicians receive: office support, remote/telehealth availability, billing management, group/peer supervision, flexible scheduling, intake management, electronic health records access, and credentialing support.
Compensation:",-1,Abelard Psychotherapy INC.,"Boston, MA",-1,-1,-1,-1,-1,-1
741,"NY State licensed LCSW, LMHC, LMFT, Psychologist or Psychiatric NP",$68K - $110K (Employer est.),"NY State licensed Psychotherapist or Psychologist
We are a private practice that has been in Kingston for more than 30 years. We are seeking NY State licensed psychotherapists - social workers (LCSW- best with R), Marriage and Family therapist, or psychologists - on a fee-for-service (hourly employment) basis. Looking for someone who has experience working with children, adolescents and adults.
I am a licensed psychologist, certified playtherapist-supervisor, certified group therapist, energy psychologist, sandtray therapist and modern psychoanalyst. I have been in practice in Kingston for more than 30 years. Presently, there are three psychologists, six clinical social workers, six licensed mental health counselors, one marriage and family therapist, one music therapist working several limited permit holders with me on a fee-for-service basis.
The office provides clients, office staff, office space, an electronic health record program, credentialing, and billing. At the moment all services are conducted via telehealth. We offer health insurance, vision and dental insurance, a retirement plan, and a match to the retirement plan, paid vacation and a bonus for extended hours worked on a quarterly basis. We are a very colleague-based team, and try to help each other out as much as possible. We usually have one social get together during the summer and one during the winter. We provide two weekly group consultations and individual consultation on an as needed basis. The practice is mainly managed care based, thus it would be very helpful if you were eligible or already on the managed care panels.",-1,"Grunblatt Psychology and Counseling Offices, PC",Remote,-1,-1,-1,-1,-1,-1
742,Registered Associate Marriage and Family Therapist (AMFT),$68K - $110K (Employer est.),"Job Responsibilities of a Registered Mental Health Counselor Associate:
Provide clinical services including individual/family/couples, children, intakes, assessments, and treatment planning in an outpatient setting
Carry a caseload of 15+ clients. This is very important as this caseload is a requirement
Work at least 2 evenings and 1 weekend day
Attend group consultation and One to One TBD
Maintain accurate, thorough and timely client records that meet agency and licensing standards
Abide by code of ethics",-1,Paloma Mental Health INC.,Remote,-1,-1,-1,-1,-1,-1
743,Online Therapist - LCPC / LCSW / LMFT / Psychologist,$68K - $110K (Employer est.),"Private practice made simple.
Great Lakes Psychology Group is offering a flexible career opportunity for a Contractual Psychotherapist to join our growing network and see clients in-person and/or online. We make it easy for you to run the stress-free private practice of your dreams.
You control how you practice: Online, in-person, or both!
Practice online or see clients in person from one of our many Illinois offices without the additional stress of startup costs. We can build a full caseload for your practice in 2-3 months.
If you'd like to learn more, please visit: careers.glpg.net
Benefits of joining the GLPG network:",4.5,"Great Lakes Psychology Group
4.5","Schaumburg, IL",201 to 500 Employees,2011,Company - Private,Health Care Services & Hospitals,Health Care,Unknown / Non-Applicable
744,Remote Licensed Marriage & Family Therapist,$68K - $110K (Employer est.),"Are you a licensed marriage and family therapist looking to grow or launch a private practice? Headway has partnered with over 8,500 providers across the United States to help them run and build their practices, while making care more accessible and affordable for their clients.
Whether you're new to private practice or have an established practice of your own, we're excited to welcome you to the Headway community and help you reach your goals!
We’ll help you with...
Referrals: Use our referral streams to get matched with clients based on your preferences.
Insurance credentialing: Free, fast, and hassle-free credentialing with the nation’s largest networks.",-1,Headway,Florida,-1,-1,-1,-1,-1,-1
745,Outpatient Therapist - LCPC / LCSW / LMFT / Psychologist,$68K - $110K (Employer est.),"Private practice made simple.
Great Lakes Psychology Group is offering a flexible career opportunity for a Contractual Psychotherapist to join our growing network and see clients in-person and/or online. We make it easy for you to run the stress-free private practice of your dreams.
You control how you practice: Online, in-person, or both!
Practice online or see clients in person from one of our many Illinois offices without the additional stress of startup costs. We can build a full caseload for your practice in 2-3 months.
If you'd like to learn more, please visit: careers.glpg.net
Benefits of joining the GLPG network:",4.5,"Great Lakes Psychology Group
4.5","Chicago, IL",201 to 500 Employees,2011,Company - Private,Health Care Services & Hospitals,Health Care,Unknown / Non-Applicable
746,"Telehealth for LCPC, LCSW and LCMFTs Holding Licensure in Kansas",$68K - $110K (Employer est.),"Advantages of Working for MeMD Provider Network
Compensated per consultation, 40-50 minute sessions
Create your own schedule, 5 hours per week availability required
Must be independently licensed in Kansas, but can work from anywhere in the United States
Assistance with obtaining new licenses via our multi-state agreement
Essential Job Functions
Conduct initial and follow up care via video and phone technology
Work as an independently contracted provider",4.6,"MeMD
4.6",Remote,51 to 200 Employees,-1,Company - Private,Health Care Services & Hospitals,Health Care,Unknown / Non-Applicable
747,Licensed Marriage and Family Therapist,$68K - $110K (Employer est.),"About us
Aurora Counseling is a small business based in Fullerton California and providing services throughout La Puente and La Habra. Aurora Counseling is a small private practice owned by a LMFT. Our work is focused on working with individuals placed in EBSH homes and our work consists of providing therapy services with multiple vendors that work directly with California regional centers throughout Orange, Los Angeles & San Bernardino County. We are person centered and client focused in providing our services, and representing ourselves in the outmost professional and caring manner to our vendors and clients.
Our work environment includes:
Safe work environment",-1,Aurora Counseling,"La Puente, CA",-1,-1,-1,-1,-1,-1
748,"Outpatient Therapist - Need 3,000 hours for Supervision? Welcome",$68K - $110K (Employer est.),"Outpatient Counselor
Outpatient Psychotherapist/Licensed Professional Counselor/Licensed Clinical Social Worker/Licensed Marriage and Family Therapist/Psychologist
Full-time/Part-time
We possess a passion for patient care as demonstrated in our excellence in therapeutic services. Outpatient clinic in Kenosha, WI and Twin Lakes, WI is currently seeking a contracted Licensed Professional Counselor (LPC, LPC-IT) or Licensed Clinical Social Worker (LCSW, APSW) or Licensed Marriage & Family Therapist (LMFT) or Clinical Psychologist to provide excellence in patient care through individual and family therapies.
Preference will be given to candidates who offer specific specialties and are credentialed with insurance networks.",-1,TTServices LLC,Wisconsin,-1,-1,-1,-1,-1,-1
749,Licensed Marriage and Family Therapist,$68K - $110K (Employer est.),"Our clinicians have the opportunity to work in both our intensive programs and outpatient levels of care, seeing individuals, couples, or families, and facilitating groups. Our clinic is the perfect place to work if you love the interdisciplinary team-like environment, but also appreciate the independence and flexibility of private practice. We offer competitive salaries and benefits, including health insurance and paid vacation.
Our clinic is expanding, so we are looking for experienced, licensed clinicians who can bring their specialized area of interest to our team (e.g. DBT team lead, Eating Disorder specialist, experienced Family Therapist, etc).
Responsibilities
Provide therapy sessions both in-person and online (individual, family, and groups)",-1,Mind Therapy Clinic,"San Francisco, CA",-1,-1,-1,-1,-1,-1
750,Licensed Marriage and Family Therapist,$68K - $110K (Employer est.),"What we're looking for:
NAMHS is looking for a Licensed Marriage and Family Therapist to join our team in Salinas, CA. NAMHS is looking for patient focused therapist for a variety of patients. If you have the necessary skills and experience to succeed in this role, we want to hear from you.
What we offer:
We offer an unmatched extensive training program for our providers to be successful. We offer paid supervision hours with a Licensed Marriage and Family Therapist. Benefits package offers paid vacation, sick time, medical, dental, vision, life insurance, and 401K.
Working with us:",3.5,"North American Mental Health Services
3.5","Salinas, CA",51 to 200 Employees,-1,Company - Public,-1,-1,Unknown / Non-Applicable
751,Licensed Marriage and Family Therapist/Licensed Mental Health Counselor,$68K - $110K (Employer est.),"The Family Center is looking for clinicians to join our team of Marriage and Family Therapists and Mental Health Counselors. We provide individual, couples, and family therapy to people in the Baldwinsville and Syracuse community. We strive to provide an accepting caring atmosphere and solid therapeutic experience to our clients, while maintaining a healthy work life balance.
We are hiring for part-time (15 clinical appointments a week) and full time positions (+20 clinical appointments a week); both employee and contractor positions.
We have senior level clinicians who provide support and supervision on a weekly basis. We have monthly trainings, yoga and meditation classes for staff. We enjoy our job and have a lot of fun.
Our client population is extremely varied as we have many talented clinicians with a variety of specialties. If you are looking to broaden your experience in working with children, teens, adults, or specific presenting problems this is a good place for you to work.",3.0,"The Family Center
3.0","Baldwinsville, NY",1 to 50 Employees,-1,Nonprofit Organization,-1,-1,Unknown / Non-Applicable
752,Licensed Marriage and Family Therapist,$68K - $110K (Employer est.),"The Location
Stallant Health Crescent City is a rapidly-growing Rural Health Clinic located on the pristine coastline of northern California. Surrounding our location you will find endless camping, hiking, cycling, water sports, and many other outdoor activities. The nature here is stunning.
The Company
One of our biggest values is providing an outstanding, positive, and supportive work environment, allowing you to grow, explore, and develop your professional skills and interests as part of an incredible team. To do this, we need supportive teammates, so we hire the best we can, bringing together strong talent and personality into our workplace culture. This company is also growing rapidly and learning new things so we need people who can grow and flex just as much as we do.",-1,Stallant Health Crescent City,"Crescent City, CA",Unknown,-1,Hospital,-1,-1,Unknown / Non-Applicable
753,Licensed Marriage and Family Therapist,$68K - $110K (Employer est.),"The Behavioral Health Center for Counseling & Learning, LLC is a thriving private practice that is a leader in providing exceptional services in Connecticut since 2006. The Center provides comprehensive services (individual, couples, families, and group therapy) throughout the entire developmental lifespan, from toddler to adolescent, and adult through geriatric. Our diverse clinical team has expertise in helping our clients address all of the issues that act as barriers to positive development and the achievement of success.
Our integrative approaches to wellness are unparalleled.
We are offering an exciting opportunity to practice as an independent contractor, while having the benefit of working with a skilled team of licensed and experienced professionals, some of whom have been practicing for decades.
Successful candidates must be licensed in CT.",-1,"The Behavioral Health Center for Counseling & Learning, LLC","Shelton, CT",Unknown,-1,Company - Public,-1,-1,Unknown / Non-Applicable
754,Fully Remote Licensed Marriage and Family Therapist or LCSW,$68K - $110K (Employer est.),"Location: Ensemble Therapy is looking for a on-site or REMOTE/ONLINE full-time LMFT or LCSW to join our multidisciplinary treatment team. You may choose on-site work at our clinic facility in Palm Desert, California, a hybrid position, or online/remote.
Why work at Ensemble Therapy :
We are professionals making a difference in our patients lives. Working at Ensemble you will be given the tools to be successful in your dream job, have peer and management support. Monthly all hands meeting includes individual spotlight awards, recognition, and other celebrations.
About Ensemble Therapy:
Our mission is to provide comprehensive, caring, and convenient board-certified Speech Therapy, Occupational Therapy, Physical Therapy, Applied Behavior Analysis Therapy, and Psychological services to children and adults of all ages and diagnoses. Utilizing a multidisciplinary approach, we provide effective personalized multi-lingual intervention that improves the lives of the individuals and families we serve.",-1,Ensemble Therapy,California,-1,-1,-1,-1,-1,-1
755,Independent Contract Therapist-Telehealth,$68K - $110K (Employer est.),"Helping people while living satisfying, balanced lives. That is the focus for our team at Elevation Individual and Family Therapy. We are a team of licensed therapists that value providing quality, person-centered services in a low-stress environment to aid in a healthy work-life balance. You set your work hours, complete your progress notes and we take care of the rest! Elevation IFT is looking for a passionate, reliable therapist who enjoys being their own boss and working with clients to achieve their treatment goals.
To learn more about us, visit our website at www.elevationtherapy.org
Responsibilities
Collaborate with clients to develop treatment plans
Maintain clinical progress notes and other required documentation that meets the standards of insurance companies and Employee Assistance Programs (EAP).",-1,"Elevation Individual and Family Therapy, LLC","Homewood, IL",-1,-1,-1,-1,-1,-1
756,Licensed Therapist - Telehealth (Remote),$68K - $110K (Employer est.),"Licensed Therapist in California
Anchor Counseling Group, Inc. (ACG) is a community oriented group practice in Glendale, California. Our goal is to provide mental health services backed by experience, science, and proven treatments. We strive to make a difference in our community by promoting the growth and development of each of our client’s individual needs.
Our focus is also on providing a supportive environment for our clinicians. Our staff is always there to support the needs of the team and foster a culture of professionalism, collaboration and encouragement.
We are looking for a community minded, compassionate, and clinically skilled Licensed Marriage and Family Therapist (LMFT), Licensed Clinical Social Worker (LCSW), and Clinical Psychologist. We have openings for full-time and part-time positions.",-1,"Anchor Counseling Group, Inc.",California,-1,-1,-1,-1,-1,-1
757,Therapist Mental Health,$68K - $110K (Employer est.),"Interested in expanding the reach of mental health care in our communities? Interested in joining a rapidly growing organization that puts people first and the communities we serve at the center?
The Josselyn Center team is growing as we expand our Community Mental Health Centers in Northfield, IL and Waukegan, IL! We are seeking Master's Level Therapists to join our team!
We are working to bring quality, comprehensive mental health care to as many people as possible, especially those traditionally underserved.
The Josselyn Difference:
Josselyn is a not-for-profit mental health care provider treating clients from more than 90 communities across northern Cook and Lake counties, with a sliding fee scale.",3.5,"Josselyn
3.5","Chicago, IL",51 to 200 Employees,1951,Nonprofit Organization,Social Assistance,Non-Profit,$1 to $5 million (USD)
758,Licensed Marriage and Family Therapist,$68K - $110K (Employer est.),"Our clinic is seeking a Family Therapist with expertise in couples' therapy to primarily work with families. The ideal candidate will have earned their PhD in Family Therapy, have completed an APA accredited internship or post-doctoral residency, and have experience working with children, adolescents, adults and families. This is a full-time position that also requires the therapist to complete paperwork, client evaluations, client contact via email and phone, maintaining client confidentiality and assisting with corporate activities for the clinic.
Job Types: Full-time, Part-time
Pay: $50.00 - $70.00 per hour
Benefits:
Dental insurance",-1,caulfield counseling,"Banning, CA",-1,-1,-1,-1,-1,-1
759,Licensed Marriage and Family Therapist,$68K - $110K (Employer est.),"Progeny Psychiatric Clinic is looking to hire on full-time LMFT'a to be stationed at our Anheim, Huntington Beach, and Dana Point Location. Income is production based. Please submit resume and availability to start.
Job Types: Full-time, Contract
Pay: Up to $65.00 per hour
Medical Specialty:
Psychiatry
Schedule:
10 hour shift",-1,Progeny Psychiatric Clinic,"Dana Point, CA",-1,-1,-1,-1,-1,-1
760,"Marriage and Family Therapist $70-80/hr ($140,000/yr FT)",$68K - $110K (Employer est.),"Therapists deserve to be treated with respect. Clients deserve to be matched with a high-quality therapist. That’s why Path Mental Health exists. Do you want to earn what you deserve? Do you want to have a dedicated support, marketing, and billing team? Do you want to be matched with clients and help them? Do you believe in high quality care? If so, we want to hear from you.
A few reasons why you might want to join:
Full Caseload: take advantage of our marketing and partnerships to get matched with the exact type of clients you want immediately.
Consistent Total Earnings: since we fill you up quickly AND keep you full, you will actually earn what you want to make and never have to worry about missing a payment, as we do direct deposit every two weeks. You’re guaranteed payment for every visit you do (with no-show protection).",5.0,"Path Mental Health
5.0",California,1001 to 5000 Employees,2019,Company - Private,Health Care Services & Hospitals,Health Care,Unknown / Non-Applicable
761,Licensed Family Counselor,$68K - $110K (Employer est.),"About us
Autism F.I.R.S.T. Our mission is to deliver on our belief in Relational Autism Care, a simple and profound belief that as autism so greatly impacts the family dynamic that the treatment care must support and be available for all members of the family that are touched and impacted by autism – the patient, the family and all caregivers.
Autism F.I.R.S.T. is Northern Virginia’s only autism therapy practice to provide the ultimate collaborative treatment, advocacy, support, and care for the autistic child, family, and caregivers. We are seeking a Licensed Family Counselor (LPC; LCSW; LMFT) to contract with our team. Recognizing the profound impact autism has on the family and support system, we seek to provide broad collaborative care. The counselor will focus on providing family counseling services and support to the families and caregivers of autistic children following our relational autism care model.",-1,Autism F.I.R.S.T.,Remote,-1,-1,-1,-1,-1,-1
762,Therapist,$68K - $110K (Employer est.),"Licensed Therapist (California)
Licensed - Therapist - LMFT, LCSW, Psy.D. / Ph.D, or Clinical Social Worker
Change Within Reach is a mental health clinic providing psychotherapy services to a wide array of clients. We offer opportunities to work with children, adolescents, teens, and adults of all ages.
We serve culturally diverse populations of various socio-economic backgrounds and age groups. Change Within Reach will provide you with as many clients as you need, we are extremely busy. Our culture and values guide how we work and treat one another. Change Within Reach celebrates diversity and fosters an inclusive environment, seeking ideas and opinions from everyone on the team.
We are currently hiring ONLY California LICENSED clinicians - Licensed Clinical Social Workers (LCSWs), Licensed Marriage and Family Therapists (LMFTs) and Licensed Clinical Psychologists (Ph.D/Psy.D). to provide psychotherapy services via telehealth. Both part time and full time positions are available.",-1,"Change Within Reach, Inc.",Remote,-1,-1,-1,-1,-1,-1
763,Mental Health Therapist - Permanently Remote,$68K - $110K (Employer est.),"Welcome to Foresight Mental Health. We're so glad you're considering joining our team.
More support and innovative tools for better care
As a provider with Foresight, we want you to focus on what's most important - treating and caring for our members. Which is why we have a team dedicated to handling all the administrative aspects of therapy: credentialing, scheduling, billing and marketing. This extended support gives you the time and space you need to be present and engaged with our members.
You'll also enjoy support from your colleagues during small-group case consultation weekly meetings. These location-based groups are an intimate way to collaborate with other therapists and build community and camaraderie.
And with our in-house bioengineers and software developers, we've created a suite of care-enhancing tools meant to empower you with additional data and insights to better inform your approach.",4.8,"Foresight Mental Health
4.8","Chicago, IL",201 to 500 Employees,2018,Company - Private,Health Care Services & Hospitals,Health Care,Unknown / Non-Applicable
