,Job Title,Salary Estimate,Job Description,Rating,Company Name,Location,Size,Founded,Type of ownership,Industry,Sector,Revenue
0,"Marriage and Family Therapist $70-80/hr ($140,000/yr FT)",Employer Provided Salary:$70 - $80 Per Hour,"Therapists deserve to be treated with respect. Clients deserve to be matched with a high-quality therapist. That’s why Path Mental Health exists. Do you want to earn what you deserve? Do you want to have a dedicated support, marketing, and billing team? Do you want to be matched with clients and help them? Do you believe in high quality care? If so, we want to hear from you.
A few reasons why you might want to join:
Full Caseload: take advantage of our marketing and partnerships to get matched with the exact type of clients you want immediately.
Consistent Total Earnings: since we fill you up quickly AND keep you full, you will actually earn what you want to make and never have to worry about missing a payment, as we do direct deposit every two weeks. You’re guaranteed payment for every visit you do (with no-show protection).",5.0,"Path Mental Health
5.0",California,1001 to 5000 Employees,2019,Company - Private,Health Care Services & Hospitals,Health Care,Unknown / Non-Applicable
1,Licensed Marriage and Family Therapist,Employer Provided Salary:$40 Per Hour,"Our office is looking for a licensed marriage therapist.'
'
Benefit Conditions:
Only full-time employees eligible
Contract Length:
More than 1 year
Contract Renewal:
Likely
Full Time Opportunity:",-1,Mind Matters PsychiatryMD,"Flower Mound, TX",-1,-1,-1,-1,-1,-1
2,Child and Family Play Therapist - Independent Contractor,Employer Provided Salary:$80 - $90 Per Hour,"Creative Family Counseling, an outpatient private practice that serves children, adolescents, and adults in individual, couples, & family therapy, seeks an independent contractor therapist to work with children, teens, and families. We are seeking those with experience and/or specialized training in treating issues commonly seen in children such as outbursts/tantrums, behavior issues, stress/anxiety, trauma, self-esteem, depressed mood, ADHD, etc. It is important for us to find someone who is passionate in helping children and their parents within a systemic framework and who is a self-motivated person. The ideal candidate would have a foundation and experience in utilizing expressive and play therapies and be open to becoming Certified in the Positive Discipline parenting curriculum.
Candidate must be passionate about working with children between ages 3 and 18. The primary caseload for this Therapist's position will be for clients ages 3-13.
The hours are flexible. You set your own appointments in collaboration with other therapists who use the fully furnished play therapy offices.",-1,Creative Family Counseling,"Louisville, KY",-1,-1,-1,-1,-1,-1
3,Licensed Family Counselor,Employer Provided Salary:$75 Per Hour,"About us
Autism F.I.R.S.T. Our mission is to deliver on our belief in Relational Autism Care, a simple and profound belief that as autism so greatly impacts the family dynamic that the treatment care must support and be available for all members of the family that are touched and impacted by autism – the patient, the family and all caregivers.
Autism F.I.R.S.T. is Northern Virginia’s only autism therapy practice to provide the ultimate collaborative treatment, advocacy, support, and care for the autistic child, family, and caregivers. We are seeking a Licensed Family Counselor (LPC; LCSW; LMFT) to contract with our team. Recognizing the profound impact autism has on the family and support system, we seek to provide broad collaborative care. The counselor will focus on providing family counseling services and support to the families and caregivers of autistic children following our relational autism care model.",-1,Autism F.I.R.S.T.,Remote,-1,-1,-1,-1,-1,-1
4,Licensed Marriage and Family Therapist,Employer Provided Salary:$110K - $150K,"The Behavioral Health Center for Counseling & Learning, LLC is a thriving private practice that is a leader in providing exceptional services in Connecticut since 2006. The Center provides comprehensive services (individual, couples, families, and group therapy) throughout the entire developmental lifespan, from toddler to adolescent, and adult through geriatric. Our diverse clinical team has expertise in helping our clients address all of the issues that act as barriers to positive development and the achievement of success.
Our integrative approaches to wellness are unparalleled.
We are offering an exciting opportunity to practice as an independent contractor, while having the benefit of working with a skilled team of licensed and experienced professionals, some of whom have been practicing for decades.
Successful candidates must be licensed in CT.",-1,"The Behavioral Health Center for Counseling & Learning, LLC","Middlebury, CT",Unknown,-1,Company - Public,-1,-1,Unknown / Non-Applicable
5,"Licensed Counselors, Social Workers, Marriage and Family Therapist",Employer Provided Salary:$60K - $120K,"Agape Counseling Associates is experiencing rapid growth and we are seeking Licensed Therapists (Psychologists, Licensed Clinical Social Workers, Licensed Marriage and Family Therapists, Licensed Clinical Mental Health Counselor) to join our extremely busy practice in Morehead City.
Our relational team is committed to a mission of restoring souls to health and peace. Through Agape, enjoy the benefits of collaborating with your colleagues, gaining professional development and building your private practice with team members, who share your core values as a therapist.
We are passionate about helping individuals and families work through struggles with depression, anxiety, addictions, eating disorders, grief, trauma, PTSD, and co-occurring disorders.
For over 19 years, Agape Counseling has earned a stellar reputation, our clinicians are well respected in the community and known for specialized skills offering treatment for children to geriatrics and each life stage in between.",-1,"Agape Counseling Associates, Inc.","Morehead City, NC",-1,-1,-1,-1,-1,-1
6,Telehealth Licensed Marriage & Family Therapist (LMFT) - Maryland,-1,"MDstaffers is seeking a qualified Telehealth Licensed Marriage & Family Therapist (LMFT) Maryland
Job Description:
Telehealth Licensed Marriage & Family Therapist (LMFT) needed in Maryland. This is a fully remote opportunity where you can provide consults from the comfort of your own home, office, or private setting. Flexible scheduling allows you to have a healthy work-life balance.
Details:
Work from home!
Flexible scheduling
Permanent position",2.9,"MDstaffers
2.9",Maryland,51 to 200 Employees,2010,Company - Private,Health Care Services & Hospitals,Health Care,Unknown / Non-Applicable
7,LMFT - Licensed Marriage and Family Therapist,$52K - $104K (Glassdoor est.),"Invo-Progressus is the nation’s leading special education and early intervention company nationwide, and we’re hiring! We are currently expanding our team of Licensed Marriage and Family Therapists in Fairfield, CA and have an incredible full-time opportunity available in an educational setting. For additional information, call 800-892-0640 to speak with a dedicated Career Services Manager.

For more than twenty years, Invo-Progressus has been providing therapeutic services that create better outcomes for children. The Invo-Progressus team is comprised of some of the nation’s most talented and influential education and therapy leaders all of whom have a keen understanding of how to meet the unique needs of school districts, children and families and help them succeed. We are committed to helping children and families, school leaders and clinicians achieve success.

Best Practices. Best Careers. Best Outcomes for Children.",3.2,"Invo-Progressus
3.2","Fairfield, CA",51 to 200 Employees,1993,Company - Private,K-12 Education,Education,Unknown / Non-Applicable
8,Marriage and Family Therapist - FT Opportunity with Excellent Benefits!,Employer Provided Salary:$60K,"Destinations For Teens is a treatment center for teens struggling with substance use and mental health, that specializes in providing exceptional service and accessible care for the teen and their family.
Destinations is one of the premier teen treatment centers in the country. Both our residential and outpatient programs are designed to support the whole family throughout their journey to sustainable well-being. By providing a quality safe-haven, a full range of treatments, and an uninterrupted education, we have one of the highest rates of success in the country. Whether treating mental illness, addiction, or both, we pride ourselves in exceptional service and accessible care for the teen and their family. Our priority is to treat each teen with the goal of establishing a pathway to realizing a stable and healthy future.",2.2,"Destinations to Recovery
2.2","Thousand Oaks, CA",1 to 50 Employees,-1,Unknown,-1,-1,Less than $1 million (USD)
9,Licensed Marriage and Family Therapist-Quality Assurance Contractor,Employer Provided Salary:$50 - $60 Per Hour,"Personal Involvement Center, Inc. a community based social services agency and a leader in providing children and family services for over 40 years has a new job opening for a LMFT Quality Assurance Contractor. Quality Assurance Contractor is responsible for supervising the day-to-day operations of Mental Health-Quality Assurance which include: supervision of staff; review and track client documentation, maintain and develop Quality Assurance plan including objectives, policies, standards procedures, and guidelines for monitoring, reporting, and correction of quality assurance/compliance issues according to “PIC” and outside regulatory bodies, etc.
Previous experience in a community based social services agency setting preferred, proficiency in a data entry computer database.
Job Types: Full-time, Part-time, Contract",1.4,"Personal Involvement Center, Inc.
1.4","Los Angeles, CA",1 to 50 Employees,-1,Nonprofit Organization,-1,-1,$5 to $10 million (USD)
10,Licensed Marriage and Family Therapist,Employer Provided Salary:$59K - $104K,"Inside Passage Relationship Counseling is a boutique private group therapy practice in Bellingham, Washington dedicated to providing the highest quality, evidence-based relationship therapy to individuals, couples, and families.
We are hiring highly skilled, licensed therapists who want to work in a private practice environment with a group of passionate, inspiring, and supportive therapists. We can help you strike your ideal work-life balance with a part-time or full-time case load of highly motivated, appreciative clients.
We will take care of all the legal, business, and administrative obligations so that you can focus on doing your best, most fulfilling work. Therapists who work with us can earn between $64,000 and $104,000+ annually.
By joining our practice, you can focus on what you love: providing rewarding, effective therapy and we will take care of the rest, including:",-1,Inside Pasage Relationship Counseling,"Bellingham, WA",-1,-1,-1,-1,-1,-1
11,Licensed Marriage and Family Therapist,Employer Provided Salary:$50 - $70 Per Hour,"Our clinic is seeking a Family Therapist with expertise in couples' therapy to primarily work with families. The ideal candidate will have earned their PhD in Family Therapy, have completed an APA accredited internship or post-doctoral residency, and have experience working with children, adolescents, adults and families. This is a full-time position that also requires the therapist to complete paperwork, client evaluations, client contact via email and phone, maintaining client confidentiality and assisting with corporate activities for the clinic.
Job Types: Full-time, Part-time
Pay: $50.00 - $70.00 per hour
Benefits:
Dental insurance",-1,caulfield counseling,"Banning, CA",-1,-1,-1,-1,-1,-1
12,Licensed Marriage and Family Therapist,Employer Provided Salary:$40 - $48 Per Hour,"Licensed Marriage and Family Therapist Intern LMFTI – Job Post
Evolving Reflections
Urgently Hiring
Full Job Description
LMFTI Licensed Marriage and Family Therapist Intern
Job Description
I am looking for a passionate, energetic, and caring team member to join our team! I am seeking a part-time or full-time LMFTI Licensed Marriage and Family Therapist Intern or CPC Certified Professional Counselor to help clients face life challenges. Compensation is based on total experience.",-1,Evolving Reflections,"Las Vegas, NV",-1,-1,-1,-1,-1,-1
13,Fully Remote Licensed Marriage and Family Therapist or LCSW,Employer Provided Salary:$85K - $95K,"Location: Ensemble Therapy is looking for a on-site or REMOTE/ONLINE full-time LMFT or LCSW to join our multidisciplinary treatment team. You may choose on-site work at our clinic facility in Palm Desert, California, a hybrid position, or online/remote.
Why work at Ensemble Therapy :
We are professionals making a difference in our patients lives. Working at Ensemble you will be given the tools to be successful in your dream job, have peer and management support. Monthly all hands meeting includes individual spotlight awards, recognition, and other celebrations.
About Ensemble Therapy:
Our mission is to provide comprehensive, caring, and convenient board-certified Speech Therapy, Occupational Therapy, Physical Therapy, Applied Behavior Analysis Therapy, and Psychological services to children and adults of all ages and diagnoses. Utilizing a multidisciplinary approach, we provide effective personalized multi-lingual intervention that improves the lives of the individuals and families we serve.",-1,Ensemble Therapy,California,-1,-1,-1,-1,-1,-1
14,Registered Associate Marriage and Family Therapist (AMFT),Employer Provided Salary:$25 - $28 Per Hour,"Job Responsibilities of a Registered Mental Health Counselor Associate:
Provide clinical services including individual/family/couples, children, intakes, assessments, and treatment planning in an outpatient setting
Carry a caseload of 15+ clients. This is very important as this caseload is a requirement
Work at least 2 evenings and 1 weekend day
Attend group consultation and One to One TBD
Maintain accurate, thorough and timely client records that meet agency and licensing standards
Abide by code of ethics",-1,Paloma Mental Health INC.,Remote,-1,-1,-1,-1,-1,-1
15,Licensed Marriage and Family Therapist,Employer Provided Salary:$50 - $60 Per Hour,"Telehealth Part-Time (Full-Time available) Positions for Licensed California Providers
California LMFT/ LCSW/LPCC
Make a difference working with children, couples, and adults. Our mission is to provide holistic, culturally sensitive services in helping our clients address their needs and improve their quality of life. Sandbox Family Services, Inc. is seeking Licensed Clinicians to join our growing group practice. Sandbox is a multi-specialty and multi-lingual group of mental health professionals.
Sandbox works with a diverse population of children, adults, and older adults. We provide individual, couples, and family therapy. Client inquiries, screenings, scheduling, insurance credentialing, and paneling are handled by our Office staff.
We are looking for independent, tech-savvy, motivated providers to join our group practice. Providers have the flexibility of setting their own schedules.",-1,Sandbox Family Services,"Pasadena, CA",-1,-1,-1,-1,-1,-1
16,Remote Licensed Marriage and Family Therapist,Employer Provided Salary:$112 Per Hour,"Are you a licensed marriage and family therapist looking to grow or launch a private practice? Headway has partnered with over 8,500 providers across the United States to help them run and build their practices, while making care more accessible and affordable for their clients.
Whether you're new to private practice or have an established practice of your own, we're excited to welcome you to the Headway community and help you reach your goals!
We’ll help you with...
Referrals: Use our referral streams to get matched with clients based on your preferences.
Insurance credentialing: Free, fast, and hassle-free credentialing with the nation’s largest networks.",-1,Headway,Texas,-1,-1,-1,-1,-1,-1
17,Licensed Marriage and Family Therapist,Employer Provided Salary:$40 - $60 Per Hour,"LMFT/LCSW/LPCC will performed detailed psychological assessment, diagnosis formulation, treatment planning, treatment intervention and psycho-education to clients and/or family members. Worked with SED individuals for weekly individual treatment using various EBP such as TF-CBT, Seeking Safety, MAP and IPT. The Counseling Center will credential therapist with insurance companies. Continuing Education credits provided as well as, on going training opportunities. Multiple Office locations in Riverside, Rancho Cucamonga and Telehealth. Prefer: EMDR or Brain-spotting trained'
'
Work Location:
Multiple locations
Work Remotely",-1,The Counseling Center for Individual and Family Therapy Inc.,"Riverside, CA",-1,-1,-1,-1,-1,-1
18,Associate Marriage and Family Therapist,Employer Provided Salary:$48K - $60K,"Job description
Inspire Health Centers is seeking an Associate Marriage and Family Therapist to work in our South Orange County facilities. This position supports adults struggling with moderate to severe chemical dependency. We are seeking an experienced full-time Therapist who will provide direct clinical support to those in an inpatient setting.
Job Overview and Qualifications
This position is salaried and full time. The ideal candidate will be seeking a long-term opportunity, desiring to grow with our company. Your strong work ethic, ethical integrity, ability to work independently and as a team, and strong diagnostic skills will lead to your success. Your billing drives your income, so being a self-starter is to your direct benefit.",2.0,"Inspire Health Centers
2.0","Irvine, CA",51 to 200 Employees,-1,Company - Private,Health Care Services & Hospitals,Health Care,Unknown / Non-Applicable
19,Associate Marriage and Family Therapist,-1,"Are you wanting to be a part of a true team that values connection and supporting one another? Are you wanting to be a part of a team that truly values the care they provide to their clients? If so, read on…
At Simi Psychological Group our mission is to reach the true root of our clients' struggles so they can create real lasting change in their lives. We pride ourselves in the top-notch care we provide each client who works with us in the hope that after their time with us, they will lead fuller and happier lives. We value having a connected group of clinicians who are able to support one another while allowing space for independence and personal growth.
We are different from many other group practices. We are team oriented and work hard to ensure that our team members are growing clinically, personally, and most importantly, that they are happy. While there is plenty of room for independence here, this is not a “rent a space” practice. We have weekly virtual meetings aimed at working together to ensure we are providing the best clinical care possible. Within these meetings and elsewhere we provide training opportunities to enhance your growth clinically.",-1,Simi Psychological Group,"Simi Valley, CA",-1,-1,-1,-1,-1,-1
20,Mental Health Therapist Virtual Hiring Event,Employer Provided Salary:$55K - $80K,"Mental‌ ‌Health‌ ‌Therapist‌ ‌(LMHC,‌ ‌LICSW,‌ ‌LMFT,‌ ‌LCSW)‌
NorthEast Health Services is now part of the Transformations Care Network. We are established network of behavioral health clinics that, out of a passion for providing superior patient care, is empowering our clinicians and customer service teams to provide easy access to high quality, outcomes-based care to all those that need help, and when they need it most.
Our vision is to create a united, centralized network of accessible, multi-specialty clinics that offer immediate, superior behavioral health treatment options. We provide our employees with the opportunity to grow, learn and expand their skills! We are growing rapidly and want to talk to you about what that looks like for you and your career!
We are currently adding Therapists to our growing team!",4.4,"Transformations Care Network
4.4","Plymouth, MA",501 to 1000 Employees,-1,Company - Private,-1,-1,Unknown / Non-Applicable
21,Licensed Marriage and Family Therapist (LMFT),$50K - $100K (Glassdoor est.),"*Up to $10,000 bonus potential based on level of experience and Full-Time availability*
*Full Time salaried positions available*
Carroll Counseling Center is a premier outpatient mental health clinic with several locations throughout Maryland and the Greater Baltimore area. We are seeking a Licensed Marriage & Family Therapist (LMFT) to join our outstanding team at our state-of-the-art center in Mount Airy.
Carroll Counseling Center offers individual, family and group therapy along with psychiatric/medication management services. We support work-life balance, as well as professional growth and development. Our clinicians enjoy a professional and innovative office culture that supports our therapists in building a thriving and profitable caseload.",4.4,"Carroll Counseling Centers
4.4","Mount Airy, MD",1001 to 5000 Employees,2017,Company - Private,Health Care Services & Hospitals,Health Care,$1 to $5 million (USD)
22,Licensed Bilingual Therapist - Remote,$45K - $75K (Glassdoor est.),"ABOUT US
At Vida, we empower individuals to overcome chronic mental and physical health conditions, once and for all. The impact of chronic conditions on healthcare is immense: in the US alone, chronic diseases like diabetes and heart disease drive 80% of the $3 trillion healthcare spending, which is at 18% of GDP. One in 3 individuals has a chronic health condition, and 1 in 4 struggles with mental health.
Vida provides expert, personalized, on-demand health coaching and programs from a network of experienced health care providers and leading medical institutions. Vida is a next generation continuous care platform for both consumers and businesses, combining a consumer mobile app, an enterprise care platform offering on demand 24/7 solutions for chronic conditions. Vida platform runs in the cloud, captures real-time data from 100+ devices and apps, and integrates back to the employer, payer, and provider. We are trusted by Fortune 1000 companies, major national payers and large providers to enable their employees live their healthiest lives.",4.1,"Vida Health
4.1","Chicago, IL",1001 to 5000 Employees,2014,Company - Private,Health Care Services & Hospitals,Health Care,Unknown / Non-Applicable
23,Child and adolescent/family therapist,Employer Provided Salary:$40K - $65K,"About us
Lifegrowth Psychological Services is a small but rapidly growing faith centered private practice looking to add a licensed or license-eligible, masters level counselor or doctoral level psychologist to work with children, adolescents, and families. Experience with children and adolescents is required. We currently have no competition in our market for child and adolescent services at this level and are trusted by both churches and professional referral sources as a place where people receive excellent care. A licensed individual could build a full practice within 3-6 months. We are located in a friendly community which offers affordable housing, rural and urban access, and a great school district. We are one hour from Philadelphia, 2 hours from New York City, and 3 hours from Washington D.C. As a group, we are committed to working at the highest level of professional excellence, with a passionate pursuit of integration of faith in all that we do. If you are looking for autonomy, colleagueship, ministry, and professional excellence, submit your resume via email, or contact us for more information.",-1,"Lifegrowth Psychological Services, Inc.","Boyertown, PA",-1,-1,-1,-1,-1,-1
24,Associate Marriage and Family Therapist (AMFT),$44K - $97K (Glassdoor est.),"Bay Area Clinical Associates (BACA) is dedicated to hiring, retaining and growing the best and brightest mental healthcare professionals. Our clinicians have been proud to serve California since 2007 and carry our mission and vision forward. We’re proud of our reputation for being innovative and providing high-quality care across California. But… we need you to help us!
We are hiring an Associate Marriage & Family Therapy (AMFT) to join our rapidly growing team. We are hiring for Full-time & Part-time. This role is for our San Jose, CA clinic.
Part-Time position: Monday to Thursday from 2pm-6pm (16 hours per week)
Full-Time position: Monday to Thursday from 9am-6pm (32 hours per week)
This is a temporary position that will end after the associate becomes licensed in the state of California through the BBS.",4.6,"Bay Area Clinical Associates
4.6","San Jose, CA",51 to 200 Employees,2017,Company - Private,Health Care Services & Hospitals,Health Care,Unknown / Non-Applicable
